,number,value,datetime_start,datetime_complete,duration,params_activation_fn,params_ent_coef,params_gae_lambda,params_gamma,params_lr,params_max_grad_norm,params_n_steps,params_net_arch,params_normalize_advantage,params_ortho_init,params_vf_coef,state
0,0,1.0,2023-04-26 23:26:06.532453,2023-04-26 23:27:15.683870,0 days 00:01:09.151417,relu,0.006818335368954215,0.995,0.99,0.00015900549828964448,0.4817940044254084,128,large,False,True,0.48213248212207793,COMPLETE
1,1,0.0,2023-04-26 23:27:15.684870,2023-04-26 23:28:37.215031,0 days 00:01:21.530161,relu,0.00021617543798502475,0.995,0.999,0.00260876911358765,2.799902688168293,16,small,True,True,0.22731311315921446,COMPLETE
2,2,4.0,2023-04-26 23:28:37.217028,2023-04-26 23:29:39.159840,0 days 00:01:01.942812,tanh,0.0149525521479283,0.9,0.995,0.007484772902426166,3.8732440510891553,128,tiny,False,True,0.30225784254651944,COMPLETE
3,3,1.0,2023-04-26 23:29:39.160839,2023-04-26 23:30:46.437383,0 days 00:01:07.276544,tanh,0.0013756404844543766,0.9999,0.999,0.0003397726253137245,4.661941307102299,256,small,False,False,0.807454417133363,COMPLETE
4,4,16.0,2023-04-26 23:30:46.440385,2023-04-26 23:32:11.150852,0 days 00:01:24.710467,tanh,0.0008259194839925162,0.999,0.999,0.0008468235898930719,0.4030535489271898,64,large,True,True,0.12138297806427724,COMPLETE
5,5,143.0,2023-04-26 23:32:11.152858,2023-04-26 23:33:41.832605,0 days 00:01:30.679747,tanh,2.908642966166457e-06,0.999,0.9,1.054462651762422e-05,0.35031355245043583,64,large,True,False,0.11104130423864174,COMPLETE
6,6,70.0,2023-04-26 23:33:41.834606,2023-04-26 23:35:16.527232,0 days 00:01:34.692626,tanh,2.05066880430711e-06,0.999,0.9,1.1242644658017059e-05,0.3001966165479721,32,large,True,False,0.10635961187275102,COMPLETE
7,7,1.0,2023-04-26 23:35:16.529235,2023-04-26 23:36:15.310403,0 days 00:00:58.781168,tanh,1.878498004718803e-06,0.99,0.9,1.4302211446874766e-05,0.8937178055490996,1024,tiny,True,False,0.18533234629268486,PRUNED
8,8,0.0,2023-04-26 23:36:15.311402,2023-04-26 23:37:24.160313,0 days 00:01:08.848911,relu,3.321182508974801e-05,0.95,0.98,5.304822032437819e-05,0.8110439823492788,64,large,True,False,0.15971816142125905,PRUNED
9,9,1.0,2023-04-26 23:37:24.161315,2023-04-26 23:38:21.092081,0 days 00:00:56.930766,tanh,2.444065225906471e-05,0.98,0.9999,4.540417046523181e-05,1.7899084819433715,512,large,True,False,0.10202297683320775,PRUNED
10,10,0.0,2023-04-26 23:38:21.093081,2023-04-26 23:39:13.913402,0 days 00:00:52.820321,relu,0.13233163818734686,0.999,0.9,5.35024172590737e-05,0.6779206591330815,64,small,False,False,0.29150446792332224,PRUNED
11,11,1.0,2023-04-26 23:39:13.914404,2023-04-26 23:40:06.615901,0 days 00:00:52.701497,tanh,1.028201770905353e-06,0.999,0.9,1.2761427682234583e-05,0.3035753904272494,32,large,True,False,0.10462601775836664,PRUNED
12,12,1.0,2023-04-26 23:40:06.616899,2023-04-26 23:40:58.843625,0 days 00:00:52.226726,tanh,5.3912881992228565e-06,0.999,0.9,1.1347331325617387e-05,0.31320597280461937,32,large,True,False,0.14792972389676595,PRUNED
13,13,0.0,2023-04-26 23:40:58.844623,2023-04-26 23:41:57.349118,0 days 00:00:58.504495,tanh,6.837378339119634e-06,0.999,0.9,3.245215757111127e-05,0.5143297244569947,32,large,True,False,0.14215857073034457,PRUNED
14,14,1.0,2023-04-26 23:41:57.350115,2023-04-26 23:42:46.422497,0 days 00:00:49.072382,tanh,1.0300186914631792e-06,0.98,0.9999,0.0001634610596498898,1.2568074929707054,1024,large,True,False,0.1938594575394969,PRUNED
15,15,1.0,2023-04-26 23:42:46.423492,2023-04-26 23:43:29.573749,0 days 00:00:43.150257,tanh,5.7163817289693524e-05,0.9,0.98,1.0740353482561746e-05,0.4350272653084877,256,tiny,True,False,0.12736010682307888,PRUNED
16,16,0.0,2023-04-26 23:43:29.574753,2023-04-26 23:44:28.085503,0 days 00:00:58.510750,tanh,6.464028328228334e-06,0.95,0.99,3.313894821125601e-05,0.6449745042247585,16,large,True,False,0.10520748205862278,PRUNED
17,17,1.0,2023-04-26 23:44:28.086502,2023-04-26 23:45:17.357781,0 days 00:00:49.271279,tanh,0.00014942761954479482,0.9999,0.995,2.3154417248408556e-05,0.31249679419603377,512,large,True,False,0.21770886312161444,PRUNED
18,18,1.0,2023-04-26 23:45:17.359778,2023-04-26 23:46:05.624357,0 days 00:00:48.264579,relu,1.3899940671430114e-05,0.99,0.9,8.784225570706311e-05,0.4132060782675214,32,small,False,True,0.16118629073006013,PRUNED
19,19,1.0,2023-04-26 23:46:05.625360,2023-04-26 23:46:49.228294,0 days 00:00:43.602934,tanh,7.089484061046358e-05,0.999,0.9,1.9890462450156217e-05,0.6377679352140958,64,tiny,True,False,0.12514791191767233,PRUNED
20,20,42.0,2023-04-26 23:46:49.229295,2023-04-26 23:48:05.775381,0 days 00:01:16.546086,tanh,6.606105272921155e-06,0.999,0.9,2.252959193511781e-05,1.1979284323799364,64,large,True,False,0.23675304673845038,COMPLETE
21,21,22.0,2023-04-26 23:48:05.776383,2023-04-26 23:49:20.449343,0 days 00:01:14.672960,tanh,3.551559253113242e-06,0.999,0.9,1.9222795444118837e-05,1.1317772477098014,64,large,True,False,0.25322516697608083,COMPLETE
22,22,4.0,2023-04-26 23:49:20.451343,2023-04-26 23:50:11.577430,0 days 00:00:51.126087,tanh,1.1927546915587618e-05,0.999,0.9,1.0163471222723166e-05,1.9151171712330748,64,large,True,False,0.18011331926222854,PRUNED
23,23,1.0,2023-04-26 23:50:11.578429,2023-04-26 23:51:02.645771,0 days 00:00:51.067342,tanh,2.7785120341856505e-06,0.999,0.9,2.2045718666002925e-05,0.5419641108937492,64,large,True,False,0.39780468493651305,PRUNED
24,24,1.0,2023-04-26 23:51:02.646770,2023-04-26 23:51:56.260936,0 days 00:00:53.614166,tanh,1.6795838962935247e-05,0.999,0.9,2.8108444329220372e-05,0.36472125122420324,32,large,True,False,0.1349879478778809,PRUNED
25,25,1.0,2023-04-26 23:51:56.261937,2023-04-26 23:52:47.064234,0 days 00:00:50.802297,tanh,2.8191151852154625e-06,0.999,0.9999,1.0215741929722216e-05,0.3763172041073968,64,large,True,False,0.10207477085375531,PRUNED
26,26,1.0,2023-04-26 23:52:47.065222,2023-04-26 23:53:36.649106,0 days 00:00:49.583884,relu,9.169013940412787e-06,0.98,0.98,8.034358412941228e-05,0.5293194244390217,256,large,False,True,0.16830321292139114,PRUNED
27,27,1.0,2023-04-26 23:53:36.650120,2023-04-26 23:54:25.838782,0 days 00:00:49.188662,tanh,1.9342781982793622e-06,0.995,0.995,1.866382410069297e-05,0.8206467575328934,512,large,True,False,0.21230414058793928,PRUNED
28,28,1.0,2023-04-26 23:54:25.839781,2023-04-26 23:55:09.777010,0 days 00:00:43.937229,tanh,4.318062396650213e-05,0.9,0.99,3.433624125050944e-05,0.4576116998415583,128,tiny,True,False,0.14328450095537118,PRUNED
29,29,97.0,2023-04-26 23:55:09.779008,2023-04-26 23:56:20.408192,0 days 00:01:10.629184,relu,5.451181425811095e-06,0.95,0.99,1.6348977027559954e-05,0.3665239219087912,1024,small,False,True,0.25220316094293105,COMPLETE
30,30,1.0,2023-04-26 23:56:20.410195,2023-04-26 23:57:06.828369,0 days 00:00:46.418174,relu,1.8409932221544983e-05,0.95,0.99,1.535752436746709e-05,0.3623563806117158,1024,small,False,True,0.35654146484192073,PRUNED
31,31,20.0,2023-04-26 23:57:06.829370,2023-04-26 23:57:53.543982,0 days 00:00:46.714612,relu,4.852089165209913e-06,0.95,0.99,1.897982914341733e-05,0.4786533519645271,1024,small,False,True,0.2579207855887353,PRUNED
32,32,1.0,2023-04-26 23:57:53.544984,2023-04-26 23:58:43.153880,0 days 00:00:49.608896,relu,1.5531652893409593e-06,0.95,0.99,2.5700146814906804e-05,0.32925175924604083,16,small,False,True,0.24536775917347087,PRUNED
33,33,1.0,2023-04-26 23:58:43.153880,2023-04-26 23:59:29.559143,0 days 00:00:46.405263,relu,3.145336793466118e-06,0.995,0.99,1.5461179752629427e-05,0.40640537358199924,1024,small,False,True,0.19696578873796972,PRUNED
34,34,94.0,2023-04-26 23:59:29.560140,2023-04-27 00:00:38.335030,0 days 00:01:08.774890,relu,8.227736350700616e-06,0.9999,0.999,1.0039611144029953e-05,0.3013248399987078,128,small,False,True,0.11777690784597625,COMPLETE
35,35,1.0,2023-04-27 00:00:38.337031,2023-04-27 00:01:28.108932,0 days 00:00:49.771901,relu,0.00010608687328703927,0.9999,0.999,1.407383959748e-05,0.35331582777160964,128,small,False,True,0.11808068273994804,PRUNED
36,36,0.0,2023-04-27 00:01:28.109931,2023-04-27 00:02:19.904001,0 days 00:00:51.794070,relu,2.4912435310599926e-05,0.9999,0.999,4.604983484434545e-05,0.3068851687832189,128,small,False,True,0.11518999204010362,PRUNED
37,37,1.0,2023-04-27 00:02:19.906000,2023-04-27 00:03:07.699915,0 days 00:00:47.793915,relu,0.000371113865735279,0.9999,0.999,1.04867683962731e-05,0.39828891390571025,128,small,False,True,0.15177737742328234,PRUNED
38,38,13.0,2023-04-27 00:03:07.700916,2023-04-27 00:03:58.677608,0 days 00:00:50.976692,relu,1.1724762800630078e-05,0.99,0.999,0.0003935676648860183,0.44709200995008463,128,small,False,True,0.12954231543721226,PRUNED
39,39,60.0,2023-04-27 00:03:58.678609,2023-04-27 00:05:15.903754,0 days 00:01:17.225145,relu,1.7558729842023867e-06,0.9999,0.999,1.4970143701167885e-05,0.3557169544170024,1024,small,False,True,0.11681643524825601,COMPLETE
40,40,1.0,2023-04-27 00:05:15.905753,2023-04-27 00:06:00.586457,0 days 00:00:44.680704,relu,4.018120804831968e-06,0.95,0.995,3.320581941270905e-05,0.5602073056974057,16,tiny,False,True,0.17215254348561854,PRUNED
41,41,1.0,2023-04-27 00:06:00.587455,2023-04-27 00:06:46.760601,0 days 00:00:46.173146,relu,1.4847957922388977e-06,0.9999,0.999,1.3121710772052577e-05,0.3547249463550701,1024,small,False,True,0.10998892217307274,PRUNED
42,42,1.0,2023-04-27 00:06:46.761602,2023-04-27 00:07:33.416621,0 days 00:00:46.655019,relu,1.9522594679693127e-06,0.9999,0.999,1.549372223720982e-05,0.30624815358771357,1024,small,False,True,0.11694078423573827,PRUNED
43,43,1.0,2023-04-27 00:07:33.417618,2023-04-27 00:08:20.591610,0 days 00:00:47.173992,relu,1.1280831096093124e-06,0.9999,0.999,1.5702771363358546e-05,0.3930330047834414,1024,small,False,True,0.13360074799649332,PRUNED
44,44,17.0,2023-04-27 00:08:20.593611,2023-04-27 00:09:13.795023,0 days 00:00:53.201412,relu,8.914374315369758e-06,0.9999,0.999,2.543437669863374e-05,0.4763762890902385,32,small,False,True,0.11368398659231245,PRUNED
45,45,4.0,2023-04-27 00:09:13.796022,2023-04-27 00:10:00.381087,0 days 00:00:46.585065,relu,2.8294509906643094e-05,0.9,0.98,3.9949419595073605e-05,0.3560058036774311,1024,small,False,True,0.15127402246376934,PRUNED
46,46,1.0,2023-04-27 00:10:00.382085,2023-04-27 00:10:46.967596,0 days 00:00:46.585511,relu,2.435728483305256e-06,0.995,0.9999,5.836613799608688e-05,0.30187427948739165,256,small,False,True,0.1004386308305291,PRUNED
47,47,1.0,2023-04-27 00:10:46.968597,2023-04-27 00:11:36.674962,0 days 00:00:49.706365,relu,4.252308163506064e-06,0.98,0.999,1.020202983357234e-05,0.431650714578303,32,small,False,True,0.12490175035105759,PRUNED
48,48,22.0,2023-04-27 00:11:36.675961,2023-04-27 00:12:23.695807,0 days 00:00:47.019846,relu,1.0559460703368694e-06,0.99,0.99,1.360655137163878e-05,0.3412636914147333,512,tiny,False,True,0.1394691855769801,PRUNED
49,49,1.0,2023-04-27 00:12:23.696810,2023-04-27 00:13:10.299840,0 days 00:00:46.603030,tanh,6.106751956906873e-06,0.95,0.9,2.8847112498406878e-05,0.40181421969155473,1024,small,False,True,0.1605174007421838,PRUNED
50,50,1.0,2023-04-27 00:13:10.300838,2023-04-27 00:14:00.095922,0 days 00:00:49.795084,relu,2.0967338080677398e-06,0.9999,0.999,1.792397008956579e-05,0.4772860579217637,128,large,True,False,0.11401773520789163,PRUNED
51,51,55.0,2023-04-27 00:14:00.096922,2023-04-27 00:15:19.071508,0 days 00:01:18.974586,tanh,7.139853656559661e-06,0.999,0.9,2.20504104675278e-05,0.3333746236575212,64,large,True,False,0.10010127412430875,COMPLETE
52,52,71.0,2023-04-27 00:15:19.072511,2023-04-27 00:16:37.106062,0 days 00:01:18.033551,tanh,7.659083704414037e-06,0.999,0.9,1.3110274023189173e-05,0.3340124216975598,64,large,True,False,0.10688551007644821,COMPLETE
53,53,1.0,2023-04-27 00:16:37.108060,2023-04-27 00:17:28.450038,0 days 00:00:51.341978,tanh,4.254108577109844e-06,0.999,0.9,1.287945152065475e-05,0.3316332666063351,64,large,True,False,0.1098658038621309,PRUNED
54,54,11.0,2023-04-27 00:17:28.451038,2023-04-27 00:18:24.935889,0 days 00:00:56.484851,tanh,1.786645609349057e-05,0.999,0.9,1.3479864968063762e-05,0.37600037490579796,32,large,True,False,0.12959495839723395,PRUNED
55,55,1.0,2023-04-27 00:18:24.936891,2023-04-27 00:19:15.256854,0 days 00:00:50.319963,tanh,1.1932538797833557e-05,0.999,0.9,1.0083499606064838e-05,0.30003122675333566,64,large,True,False,0.11810597011803435,PRUNED
56,56,0.0,2023-04-27 00:19:15.257854,2023-04-27 00:20:10.414677,0 days 00:00:55.156823,tanh,2.7109555281622708e-06,0.999,0.995,1.8645634673326703e-05,0.4167665918154852,64,large,True,False,0.14360623048056267,PRUNED
57,57,1.0,2023-04-27 00:20:10.415675,2023-04-27 00:20:59.232742,0 days 00:00:48.817067,tanh,3.6273889685655364e-05,0.9999,0.9999,3.8973518890511275e-05,0.5810156804000675,1024,large,True,False,0.10699409378887212,PRUNED
58,58,19.0,2023-04-27 00:20:59.233742,2023-04-27 00:21:48.658858,0 days 00:00:49.425116,tanh,5.484273365054551e-06,0.9,0.9,2.665598557669379e-05,0.4363809150608692,256,tiny,True,False,0.12622953534680018,PRUNED
59,59,1.0,2023-04-27 00:21:48.659857,2023-04-27 00:22:40.655937,0 days 00:00:51.996080,tanh,9.20992604393708e-06,0.98,0.98,1.1855796774890543e-05,0.5021556875358668,32,large,True,False,0.1584272284695567,PRUNED
60,60,1.0,2023-04-27 00:22:40.657939,2023-04-27 00:23:29.973668,0 days 00:00:49.315729,tanh,1.5028768399495758e-06,0.999,0.9,1.7340335687174225e-05,0.34104569243349897,16,small,True,True,0.17888733432062004,PRUNED
61,61,1.0,2023-04-27 00:23:29.974626,2023-04-27 00:24:20.988106,0 days 00:00:51.013480,tanh,7.314737377015276e-06,0.999,0.9,2.1331160619239205e-05,0.33252675985154817,64,large,True,False,0.10707995324067907,PRUNED
62,62,59.0,2023-04-27 00:24:20.990107,2023-04-27 00:25:39.071978,0 days 00:01:18.081871,tanh,3.301779555718989e-06,0.999,0.9,2.221822321508069e-05,0.37694387529301354,64,large,True,False,0.10141516465856262,COMPLETE
63,63,75.0,2023-04-27 00:25:39.073979,2023-04-27 00:26:56.980317,0 days 00:01:17.906338,tanh,3.4534035456874484e-06,0.999,0.9,1.2248510554904854e-05,0.3787961518503358,64,large,True,False,0.12031339959361634,COMPLETE
64,64,1.0,2023-04-27 00:26:56.982318,2023-04-27 00:27:47.688897,0 days 00:00:50.706579,tanh,2.25725437630706e-06,0.999,0.9,1.2919145234346396e-05,0.38464819931791505,64,large,True,False,0.13517614870553218,PRUNED
65,65,1.0,2023-04-27 00:27:47.689896,2023-04-27 00:28:36.820301,0 days 00:00:49.130405,tanh,3.823233307417938e-06,0.95,0.99,1.6428629825008918e-05,0.43112592546087464,512,large,True,False,0.12518782841183124,PRUNED
66,66,0.0,2023-04-27 00:28:36.821301,2023-04-27 00:29:31.978727,0 days 00:00:55.157426,tanh,1.5523976372705709e-06,0.999,0.9,1.1606796057519542e-05,0.32287107423797484,64,large,True,False,0.12027988846127301,PRUNED
67,67,0.0,2023-04-27 00:29:31.979726,2023-04-27 00:30:26.378262,0 days 00:00:54.398536,relu,5.236731866488308e-06,0.99,0.9,2.6919451841809537e-05,0.5033602490211223,128,large,False,False,0.1408437437015973,PRUNED
68,68,1.0,2023-04-27 00:30:26.379268,2023-04-27 00:31:16.610050,0 days 00:00:50.230782,tanh,1.2105035471313975e-05,0.995,0.99,1.6167936124857376e-05,0.35934409992324595,64,small,True,False,0.10911807135233398,PRUNED
69,69,1.0,2023-04-27 00:31:16.611052,2023-04-27 00:32:07.165806,0 days 00:00:50.554754,relu,2.0146486250577932e-05,0.999,0.999,1.1579289613829028e-05,0.45163676372948475,1024,large,False,True,0.19472198083705813,PRUNED
70,70,1.0,2023-04-27 00:32:07.167809,2023-04-27 00:32:56.118138,0 days 00:00:48.950329,tanh,1.0120071395370383e-06,0.95,0.995,2.086765174498786e-05,0.401258096171526,32,small,True,False,0.12291488213230559,PRUNED
71,71,1.0,2023-04-27 00:32:56.119141,2023-04-27 00:33:46.472616,0 days 00:00:50.353475,tanh,3.4931549008161194e-06,0.999,0.9,1.0197108583350137e-05,0.36800362919206586,64,large,True,False,0.10005310830386334,PRUNED
72,72,23.0,2023-04-27 00:33:46.473616,2023-04-27 00:34:41.691763,0 days 00:00:55.218147,tanh,3.0272002161197674e-06,0.999,0.9,1.4079875121866964e-05,0.378422920778872,64,large,True,False,0.10743743343923207,PRUNED
73,73,1.0,2023-04-27 00:34:41.692762,2023-04-27 00:35:32.152905,0 days 00:00:50.460143,tanh,2.175386944012008e-06,0.999,0.9,2.2654189766415154e-05,0.32592553578413813,64,large,True,False,0.11465932355359372,PRUNED
74,74,1.0,2023-04-27 00:35:32.154905,2023-04-27 00:36:22.653493,0 days 00:00:50.498588,tanh,5.158288289636476e-06,0.999,0.9,1.5899203261915655e-05,0.31832248011166614,64,large,True,False,0.13379611444675799,PRUNED
75,75,1.0,2023-04-27 00:36:22.654491,2023-04-27 00:37:12.714404,0 days 00:00:50.059913,tanh,2.971148573449256e-06,0.9999,0.9,1.901800990539736e-05,0.41193319390797734,128,large,True,True,0.10549123792844983,PRUNED
76,76,1.0,2023-04-27 00:37:12.715405,2023-04-27 00:37:56.208708,0 days 00:00:43.493303,relu,9.860311082879905e-06,0.999,0.9999,1.2957379031985734e-05,0.30183689549039455,64,tiny,False,False,0.15003087156348627,PRUNED
77,77,1.0,2023-04-27 00:37:56.209707,2023-04-27 00:38:42.281895,0 days 00:00:46.072188,tanh,1.620175806066177e-06,0.9999,0.98,3.0028695859947874e-05,0.364522853519702,1024,small,True,True,0.12052317855503616,PRUNED
78,78,1.0,2023-04-27 00:38:42.283893,2023-04-27 00:39:31.224403,0 days 00:00:48.940510,relu,1.563807079077538e-05,0.9,0.999,2.4810227339854005e-05,0.4625300980648845,256,large,False,False,0.11247621372119432,PRUNED
79,79,1.0,2023-04-27 00:39:31.226404,2023-04-27 00:40:18.210609,0 days 00:00:46.984205,tanh,7.4742401268987625e-06,0.95,0.99,1.1660578390496122e-05,0.3415243560263476,64,small,False,True,0.13374756511656494,PRUNED
80,80,1.0,2023-04-27 00:40:18.211607,2023-04-27 00:41:13.599340,0 days 00:00:55.387733,relu,4.185463559052374e-06,0.999,0.9,1.860685489706966e-05,0.3859480375790745,16,large,True,False,0.10400973163842796,PRUNED
81,81,1.0,2023-04-27 00:41:13.600339,2023-04-27 00:42:04.434816,0 days 00:00:50.834477,tanh,6.309911044818964e-06,0.999,0.9,2.2684008740600486e-05,0.3341761175770459,64,large,True,False,0.10204191466482625,PRUNED
82,82,87.0,2023-04-27 00:42:04.435819,2023-04-27 00:43:22.450919,0 days 00:01:18.015100,tanh,7.928022117047852e-06,0.999,0.9,1.4773253966464987e-05,0.3504691480165936,64,large,True,False,0.11926452724487306,COMPLETE
83,83,0.0,2023-04-27 00:43:22.452924,2023-04-27 00:44:17.702085,0 days 00:00:55.249161,tanh,2.5007930303106593e-06,0.999,0.9,1.3729843082616437e-05,0.4227793351124434,64,large,True,False,0.12016107638908129,PRUNED
84,84,1.0,2023-04-27 00:44:17.704090,2023-04-27 00:45:06.844677,0 days 00:00:49.140587,tanh,3.5174738983090257e-06,0.999,0.9,1.507493574949348e-05,0.30067509137749027,1024,large,True,False,0.12714937439698454,PRUNED
85,85,64.0,2023-04-27 00:45:06.845675,2023-04-27 00:46:24.152734,0 days 00:01:17.307059,tanh,1.4012008075402184e-06,0.98,0.999,1.1969427456252777e-05,0.3522591664054396,64,large,True,False,0.11180818660108092,COMPLETE
86,86,65.0,2023-04-27 00:46:24.155733,2023-04-27 00:47:37.389548,0 days 00:01:13.233815,relu,1.4567433269129285e-06,0.98,0.999,1.0068068489303905e-05,0.3581928677221367,32,small,False,True,0.11109130631115004,COMPLETE
87,87,1.0,2023-04-27 00:47:37.390549,2023-04-27 00:48:28.999391,0 days 00:00:51.608842,tanh,1.7771447184482326e-06,0.98,0.999,1.1605665765476235e-05,0.31770679883135955,32,large,True,False,0.11167178990483413,PRUNED
88,88,6.0,2023-04-27 00:48:29.000392,2023-04-27 00:49:17.062876,0 days 00:00:48.062484,relu,1.3891577042955828e-06,0.98,0.999,1.163405504404317e-05,0.34961307674406017,32,small,False,True,0.13955083780205943,PRUNED
89,89,1.0,2023-04-27 00:49:17.063878,2023-04-27 00:50:00.725123,0 days 00:00:43.661245,tanh,2.299453293438008e-06,0.98,0.999,1.001525814339933e-05,0.39403392506169754,32,tiny,True,False,0.1459551530216468,PRUNED
90,90,1.0,2023-04-27 00:50:00.726124,2023-04-27 00:50:52.482832,0 days 00:00:51.756708,relu,1.308083050122756e-06,0.98,0.999,1.7018150970277534e-05,0.4521826275847627,32,large,False,True,0.13049554454417006,PRUNED
91,91,1.0,2023-04-27 00:50:52.484834,2023-04-27 00:51:40.780403,0 days 00:00:48.295569,relu,1.049124589466342e-06,0.98,0.999,1.430433939635336e-05,0.35170676709645293,128,small,False,True,0.11483538073362512,PRUNED
92,92,13.0,2023-04-27 00:51:40.781401,2023-04-27 00:52:56.871208,0 days 00:01:16.089807,relu,1.9574862285286535e-06,0.98,0.999,1.2341001261447553e-05,0.3218409318329642,1024,small,False,True,0.12149788173490735,COMPLETE
93,93,1.0,2023-04-27 00:52:56.873209,2023-04-27 00:53:47.753170,0 days 00:00:50.879961,relu,4.865865620839227e-06,0.9999,0.999,1.5431064328817235e-05,0.35857594611281274,512,small,False,True,0.11090121917021718,PRUNED
94,94,1.0,2023-04-27 00:53:47.754173,2023-04-27 00:54:35.526895,0 days 00:00:47.772722,relu,1.2771312777086492e-06,0.98,0.999,1.0109237654241243e-05,0.4148336271715187,64,small,False,True,0.10636553196290185,PRUNED
95,95,50.0,2023-04-27 00:54:35.528898,2023-04-27 00:55:46.478365,0 days 00:01:10.949467,relu,2.6355317951104377e-06,0.995,0.99,1.918128324610502e-05,0.31984408579994533,32,small,False,True,0.1179281623191192,PRUNED
96,96,1.0,2023-04-27 00:55:46.479366,2023-04-27 00:56:33.972142,0 days 00:00:47.492776,tanh,1.8186639703340232e-06,0.99,0.999,1.3783164459370503e-05,0.382729863784225,64,small,True,False,0.1285562515665173,PRUNED
97,97,29.0,2023-04-27 00:56:33.974143,2023-04-27 00:57:28.563480,0 days 00:00:54.589337,relu,8.433240004615257e-06,0.9999,0.995,1.7541412682116663e-05,0.34462743262978884,128,large,False,True,0.16517645457599736,PRUNED
98,98,1.0,2023-04-27 00:57:28.564479,2023-04-27 00:58:14.802008,0 days 00:00:46.237529,tanh,5.797365591566059e-06,0.95,0.999,1.2073405764441826e-05,0.48711951101733236,1024,small,True,False,0.138008008855126,PRUNED
99,99,6.0,2023-04-27 00:58:14.803014,2023-04-27 00:59:05.814607,0 days 00:00:51.011593,tanh,3.960043822795683e-06,0.98,0.98,3.101754630976519e-05,0.5226763145707877,64,large,False,True,0.15678327857962374,PRUNED
