,number,value,datetime_start,datetime_complete,duration,params_activation_fn,params_ent_coef,params_gae_lambda,params_gamma,params_lr,params_max_grad_norm,params_n_steps,params_net_arch,params_normalize_advantage,params_ortho_init,params_vf_coef,state
400,400,4.0,2023-04-27 05:27:19.537731,2023-04-27 05:28:11.633503,0 days 00:00:52.095772,tanh,0.00046912210484064077,0.999,0.9,1.0151049356901324e-05,1.0860278492783333,32,large,True,True,0.12819057816335408,PRUNED
401,401,1.0,2023-04-27 05:28:11.634503,2023-04-27 05:28:59.610217,0 days 00:00:47.975714,tanh,9.19072240651141e-06,0.9,0.9,1.0007538172303587e-05,1.1508939426082323,32,small,True,False,0.12458406693237344,PRUNED
402,402,1.0,2023-04-27 05:28:59.611216,2023-04-27 05:29:51.619879,0 days 00:00:52.008663,tanh,6.274332081222927e-06,0.999,0.9,1.2248427612031803e-05,0.9510865794564917,32,large,False,False,0.14547748015490095,PRUNED
403,403,1.0,2023-04-27 05:29:51.620879,2023-04-27 05:30:43.328027,0 days 00:00:51.707148,tanh,1.615121619637992e-05,0.999,0.995,9.397781376320753e-05,0.3232015296620068,32,large,True,False,0.34871911175353243,PRUNED
404,404,1.0,2023-04-27 05:30:43.329026,2023-04-27 05:31:38.344550,0 days 00:00:55.015524,relu,0.0005716859437583082,0.95,0.9,1.3665101223608807e-05,0.8499308682186161,32,large,False,False,0.25455229754143144,PRUNED
405,405,1.0,2023-04-27 05:31:38.345549,2023-04-27 05:32:32.143518,0 days 00:00:53.797969,tanh,5.5420563782730734e-05,0.999,0.98,1.1680496636548789e-05,1.0496227297707983,32,large,True,True,0.13397177580760267,PRUNED
406,406,1.0,2023-04-27 05:32:32.144520,2023-04-27 05:33:16.046081,0 days 00:00:43.901561,tanh,4.084315138351197e-05,0.98,0.9,1.407251413980736e-05,0.9423513830096943,32,tiny,True,False,0.12217863962409141,PRUNED
407,407,1.0,2023-04-27 05:33:16.047081,2023-04-27 05:34:03.987168,0 days 00:00:47.940087,tanh,1.0145936288984256e-06,0.999,0.99,0.00012949027112440017,0.35185442937716666,32,small,False,False,0.1859825467491361,PRUNED
408,408,72.0,2023-04-27 05:34:03.988170,2023-04-27 05:34:58.772326,0 days 00:00:54.784156,relu,2.0404410330989466e-06,0.95,0.9,1.2009148173158428e-05,0.458891307175693,32,large,True,False,0.4161017586833707,PRUNED
409,409,47.0,2023-04-27 05:34:58.773327,2023-04-27 05:35:51.595930,0 days 00:00:52.822603,tanh,1.974857467418004e-05,0.999,0.9,0.000259210036851201,0.3350241318163411,512,large,True,False,0.11741498873388664,PRUNED
410,410,1.0,2023-04-27 05:35:51.597930,2023-04-27 05:36:45.417756,0 days 00:00:53.819826,tanh,2.631010041864211e-05,0.9,0.9,1.1200538858880222e-05,0.3813705032944261,16,large,False,True,0.24727758737824337,PRUNED
411,411,18.0,2023-04-27 05:36:45.419756,2023-04-27 05:37:35.087190,0 days 00:00:49.667434,tanh,1.5061794483009812e-06,0.995,0.9,0.0006801544679797342,0.5179660977779299,256,large,True,False,0.26240200104141653,PRUNED
412,412,1.0,2023-04-27 05:37:35.088192,2023-04-27 05:38:23.161196,0 days 00:00:48.073004,relu,8.387839838484494e-05,0.999,0.9,1.4527639372629117e-05,0.5964334985161239,32,small,False,False,0.11302538623399608,PRUNED
413,413,29.0,2023-04-27 05:38:23.162197,2023-04-27 05:39:14.201805,0 days 00:00:51.039608,tanh,4.749937578351351e-06,0.999,0.99,1.2800384547225097e-05,0.3585567172739564,64,large,True,False,0.2990270505190706,PRUNED
414,414,1.0,2023-04-27 05:39:14.202806,2023-04-27 05:40:04.742602,0 days 00:00:50.539796,tanh,1.0874005892019479e-05,0.98,0.9,1.640789631188707e-05,0.3000521373161022,64,large,True,False,0.15274988067457476,PRUNED
415,415,22.0,2023-04-27 05:40:04.743609,2023-04-27 05:40:55.799767,0 days 00:00:51.056158,tanh,0.0001264808452702734,0.95,0.995,1.0137275833761801e-05,0.7892181524021914,64,large,False,True,0.22676224038795967,PRUNED
416,416,0.0,2023-04-27 05:40:55.800766,2023-04-27 05:41:50.987052,0 days 00:00:55.186286,tanh,0.0003389894318316489,0.999,0.9999,1.2013176863122384e-05,0.7426937591745802,512,large,True,False,0.20891969406486452,PRUNED
417,417,65.0,2023-04-27 05:41:50.988051,2023-04-27 05:42:42.155243,0 days 00:00:51.167192,relu,7.361697862970178e-06,0.999,0.9,1.413211071493046e-05,0.32564921590928775,32,small,True,False,0.12083883001600793,PRUNED
418,418,1.0,2023-04-27 05:42:42.156241,2023-04-27 05:43:32.686910,0 days 00:00:50.530669,tanh,2.5940689618672824e-06,0.9,0.98,0.0010457582474634438,1.1131971974131207,64,large,False,False,0.24014245455540922,PRUNED
419,419,1.0,2023-04-27 05:43:32.687909,2023-04-27 05:44:16.171333,0 days 00:00:43.483424,tanh,1.888591182571743e-06,0.95,0.9,0.00011969317675189172,0.9819690499190715,64,tiny,True,False,0.13981408010883342,PRUNED
420,420,6.0,2023-04-27 05:44:16.172332,2023-04-27 05:45:07.154130,0 days 00:00:50.981798,tanh,3.7562293608422624e-06,0.99,0.9,1.1413868347120712e-05,0.6431910091932537,64,large,True,True,0.6146833292237518,PRUNED
421,421,46.0,2023-04-27 05:45:07.156132,2023-04-27 05:45:59.862823,0 days 00:00:52.706691,relu,1.2535483405675828e-06,0.999,0.9,0.00018949399713086797,0.4302214972770388,32,large,False,False,0.31688874099072634,PRUNED
422,422,0.0,2023-04-27 05:45:59.863824,2023-04-27 05:46:55.274030,0 days 00:00:55.410206,tanh,1.419109772469859e-05,0.98,0.99,1.692834199789696e-05,0.3464273053141697,64,large,True,False,0.27759946815166975,PRUNED
423,423,1.0,2023-04-27 05:46:55.275029,2023-04-27 05:47:43.594940,0 days 00:00:48.319911,tanh,5.347774056568106e-06,0.999,0.9,5.974488920866407e-05,1.1962851489758282,64,small,False,False,0.33868843150550226,PRUNED
424,424,1.0,2023-04-27 05:47:43.595938,2023-04-27 05:48:32.996575,0 days 00:00:49.400637,tanh,0.00023590767948869146,0.999,0.9,0.0001651072583775167,4.243443857596873,512,large,True,False,0.4126260520662881,PRUNED
425,425,1.0,2023-04-27 05:48:32.997575,2023-04-27 05:49:23.911437,0 days 00:00:50.913862,relu,2.3217252753193543e-06,0.995,0.9,1.0045368055856086e-05,0.5515681080425562,64,large,True,True,0.10826360492720727,PRUNED
426,426,52.0,2023-04-27 05:49:23.912437,2023-04-27 05:50:17.155814,0 days 00:00:53.243377,tanh,0.00015136458771363681,0.95,0.9,1.3738756277260053e-05,0.3928351988561314,32,large,False,False,0.11518131245112775,PRUNED
427,427,40.0,2023-04-27 05:50:17.156813,2023-04-27 05:51:36.028304,0 days 00:01:18.871491,tanh,3.160594647283981e-05,0.999,0.995,1.522215959162951e-05,0.31861581328749544,1024,large,True,False,0.17645208100832963,COMPLETE
428,428,88.0,2023-04-27 05:51:36.030304,2023-04-27 05:52:49.215857,0 days 00:01:13.185553,tanh,1.6482138114408332e-06,0.98,0.98,0.0005077700308347935,0.692287226355665,64,small,True,False,0.1067161872669676,COMPLETE
429,429,68.0,2023-04-27 05:52:49.218856,2023-04-27 05:53:43.267873,0 days 00:00:54.049017,tanh,1.671079095817346e-06,0.98,0.9,0.00026070352124419287,0.6188497865659518,64,large,True,False,0.10656697300405397,PRUNED
430,430,59.0,2023-04-27 05:53:43.268874,2023-04-27 05:54:32.047025,0 days 00:00:48.778151,tanh,1.274811633684069e-06,0.98,0.98,7.80751924894552e-05,0.7008216231793453,64,small,True,False,0.1058107041977322,PRUNED
431,431,66.0,2023-04-27 05:54:32.048026,2023-04-27 05:55:24.449215,0 days 00:00:52.401189,tanh,7.581491133271126e-06,0.98,0.98,0.0006463877257449347,0.5734970651835606,64,large,True,False,0.2212845289836469,PRUNED
432,432,1.0,2023-04-27 05:55:24.450214,2023-04-27 05:56:15.066397,0 days 00:00:50.616183,tanh,2.7142338748149474e-06,0.98,0.98,1.1519608299961988e-05,0.8714856248871027,64,large,True,False,0.13229613903066587,PRUNED
433,433,1.0,2023-04-27 05:56:15.067398,2023-04-27 05:56:58.557824,0 days 00:00:43.490426,tanh,4.428834876069818e-06,0.98,0.98,0.0005772750150987328,0.6679185042200677,64,tiny,True,False,0.19730310707050613,PRUNED
434,434,34.0,2023-04-27 05:56:58.558824,2023-04-27 05:57:49.980633,0 days 00:00:51.421809,tanh,4.7653678632913685e-05,0.98,0.98,0.0004002939925997057,0.7239179873264959,64,large,True,False,0.11101493843925644,PRUNED
435,435,1.0,2023-04-27 05:57:49.982636,2023-04-27 05:58:40.800279,0 days 00:00:50.817643,tanh,9.680279456310219e-06,0.98,0.98,1.2732818768895493e-05,0.4815289543934136,64,large,True,False,0.2635630720377903,PRUNED
436,436,1.0,2023-04-27 05:58:40.801278,2023-04-27 05:59:28.162186,0 days 00:00:47.360908,tanh,3.5908123354213417e-06,0.999,0.98,1.1395003269738757e-05,0.8389272116879603,64,small,True,False,0.10402212726695356,PRUNED
437,437,1.0,2023-04-27 05:59:28.163186,2023-04-27 06:00:18.606299,0 days 00:00:50.443113,tanh,0.0001013749881567418,0.9,0.9,0.0008642823335716275,0.7559829135591086,64,large,True,False,0.29518145222338893,PRUNED
438,438,4.0,2023-04-27 06:00:18.608299,2023-04-27 06:01:11.836108,0 days 00:00:53.227809,tanh,6.342281791110163e-06,0.999,0.99,1.0076489478747066e-05,3.442015652091784,32,large,True,False,0.2407514909830192,PRUNED
439,439,1.0,2023-04-27 06:01:11.837108,2023-04-27 06:02:04.553987,0 days 00:00:52.716879,tanh,6.741100362419747e-05,0.95,0.98,0.00024115074384503606,0.6264591819111972,64,large,True,False,0.1462273180901703,PRUNED
440,440,1.0,2023-04-27 06:02:04.554985,2023-04-27 06:02:54.210648,0 days 00:00:49.655663,tanh,1.7868731690470634e-06,0.98,0.9,0.002036881219562503,0.5112791677146924,256,large,True,False,0.125011565719416,PRUNED
441,441,54.0,2023-04-27 06:02:54.211647,2023-04-27 06:03:41.629037,0 days 00:00:47.417390,tanh,0.0028727501415084272,0.999,0.9,0.00019446229879334915,0.9174074100093247,512,small,True,False,0.11631713345780616,PRUNED
442,442,36.0,2023-04-27 06:03:41.630037,2023-04-27 06:04:32.716672,0 days 00:00:51.086635,tanh,0.0003313184088990615,0.999,0.9,0.0005323145072730941,1.034502535097745,64,large,True,False,0.1642828477451754,PRUNED
443,443,0.0,2023-04-27 06:04:32.717672,2023-04-27 06:05:27.931382,0 days 00:00:55.213710,tanh,0.00020177042292081804,0.999,0.9,0.0007355770571756791,0.7963694498979664,64,large,True,False,0.10004790800429487,PRUNED
444,444,1.0,2023-04-27 06:05:27.932383,2023-04-27 06:06:12.038626,0 days 00:00:44.106243,tanh,0.0006055479787049872,0.95,0.9,0.00011245773489524332,0.6539862680144173,32,tiny,True,False,0.2529058988062273,PRUNED
445,445,1.0,2023-04-27 06:06:12.040629,2023-04-27 06:07:02.656545,0 days 00:00:50.615916,tanh,1.0092073525765982e-06,0.98,0.99,0.00010406183532947224,0.5395098794202972,64,large,True,False,0.11102886661967049,PRUNED
446,446,1.0,2023-04-27 06:07:02.657544,2023-04-27 06:07:55.202596,0 days 00:00:52.545052,tanh,1.1094607358079385e-05,0.995,0.9999,0.00030646236776536137,0.9471722550433952,64,large,True,False,0.22899166641832663,PRUNED
447,447,1.0,2023-04-27 06:07:55.204597,2023-04-27 06:08:43.286986,0 days 00:00:48.082389,tanh,2.3294196796840943e-05,0.9,0.9,8.623123355417403e-05,0.31527107631943896,32,small,True,False,0.2060404329682511,PRUNED
448,448,1.0,2023-04-27 06:08:43.287985,2023-04-27 06:09:37.318608,0 days 00:00:54.030623,tanh,0.0008303167819779652,0.999,0.9,0.005824142350657378,0.37190922323561654,16,large,True,False,0.32955863966648674,PRUNED
449,449,4.0,2023-04-27 06:09:37.319609,2023-04-27 06:10:32.530617,0 days 00:00:55.211008,tanh,3.0425341540766223e-06,0.999,0.995,0.00028380390365689487,0.5952992707163817,64,large,True,False,0.3569270776584196,PRUNED
450,450,1.0,2023-04-27 06:10:32.531616,2023-04-27 06:11:23.299145,0 days 00:00:50.767529,tanh,5.361351780240434e-06,0.95,0.98,0.00043897343413421653,0.4104969833754959,512,large,True,False,0.27364357168165215,PRUNED
451,451,68.0,2023-04-27 06:11:23.300147,2023-04-27 06:12:42.244169,0 days 00:01:18.944022,tanh,1.3896369420839621e-06,0.999,0.9,0.0005438260667272129,0.7011977088326645,64,large,False,False,0.11884315832046644,COMPLETE
452,452,0.0,2023-04-27 06:12:42.246169,2023-04-27 06:13:37.541210,0 days 00:00:55.295041,tanh,2.270484945059306e-06,0.999,0.9,0.00031208825045759945,0.6814233081553596,64,large,False,False,0.12068759431416444,PRUNED
453,453,1.0,2023-04-27 06:13:37.542213,2023-04-27 06:14:25.318464,0 days 00:00:47.776251,tanh,1.3939115037287916e-05,0.999,0.9,0.0003223311111714022,0.7221595658248281,32,small,False,False,0.13068857631836517,PRUNED
454,454,1.0,2023-04-27 06:14:25.319467,2023-04-27 06:15:16.229658,0 days 00:00:50.910191,tanh,1.4255528759174144e-06,0.999,0.9,0.0005335483520824857,0.7763384332381079,64,large,False,False,0.13818605933244968,PRUNED
455,455,52.0,2023-04-27 06:15:16.231658,2023-04-27 06:16:07.465110,0 days 00:00:51.233452,tanh,3.9592917307524005e-06,0.999,0.9,0.0005029416323663707,0.8296027453072651,64,large,False,False,0.2890335765473554,PRUNED
456,456,62.0,2023-04-27 06:16:07.466112,2023-04-27 06:16:59.251361,0 days 00:00:51.785249,tanh,1.8081820216901975e-05,0.999,0.9,0.00043351097977389864,0.7360369015386838,64,large,False,False,0.11918933147664038,PRUNED
457,457,1.0,2023-04-27 06:16:59.253365,2023-04-27 06:17:43.612766,0 days 00:00:44.359401,tanh,8.377923106384805e-06,0.999,0.9,0.0003697253331266009,0.7056648678198398,32,tiny,False,False,0.1554588263663942,PRUNED
458,458,52.0,2023-04-27 06:17:43.613766,2023-04-27 06:18:38.523393,0 days 00:00:54.909627,tanh,0.00016164037819613465,0.999,0.9,0.0004694482885946373,0.8803912794553441,64,large,False,False,0.3093203156205892,PRUNED
459,459,1.0,2023-04-27 06:18:38.525393,2023-04-27 06:19:24.635093,0 days 00:00:46.109700,tanh,3.069257545178878e-05,0.999,0.9,0.0005854121731658932,1.282119631713794,512,small,False,False,0.12549563838908182,PRUNED
460,460,1.0,2023-04-27 06:19:24.637094,2023-04-27 06:20:15.326428,0 days 00:00:50.689334,tanh,0.00028739788026407674,0.99,0.9,0.0005952270752249074,1.0842509110605048,64,large,False,False,0.21396847284939638,PRUNED
461,461,1.0,2023-04-27 06:20:15.328431,2023-04-27 06:21:06.510366,0 days 00:00:51.181935,tanh,1.5298432138365739e-06,0.999,0.9,0.0004621967083541132,0.5671606646387112,64,large,False,False,0.2351897091163917,PRUNED
462,462,1.0,2023-04-27 06:21:06.511363,2023-04-27 06:22:00.079930,0 days 00:00:53.568567,tanh,4.308935285174601e-05,0.9,0.9,0.0007149506757359764,0.46622959361878624,32,large,False,False,0.2572420849955715,PRUNED
463,463,0.0,2023-04-27 06:22:00.080929,2023-04-27 06:22:55.635677,0 days 00:00:55.554748,tanh,2.07108885839014e-06,0.999,0.99,0.0005744912185587037,0.6808138349384122,128,large,False,False,0.18646884105979603,PRUNED
464,464,60.0,2023-04-27 06:22:55.636678,2023-04-27 06:23:44.042867,0 days 00:00:48.406189,tanh,6.880209661316036e-06,0.95,0.9,0.00048220120407627555,0.653172055457253,64,small,False,False,0.11402187237768897,PRUNED
465,465,1.0,2023-04-27 06:23:44.043868,2023-04-27 06:24:34.725587,0 days 00:00:50.681719,tanh,0.00010795733849208952,0.999,0.9,0.00042131675362970473,0.9816246684992186,64,large,False,False,0.1726355828915095,PRUNED
466,466,1.0,2023-04-27 06:24:34.726586,2023-04-27 06:25:24.639266,0 days 00:00:49.912680,tanh,3.1954797301599364e-06,0.995,0.98,0.00036796944553699965,0.3351685723034216,256,large,True,False,0.10537897245777515,PRUNED
467,467,1.0,2023-04-27 06:25:24.640263,2023-04-27 06:26:17.005515,0 days 00:00:52.365252,tanh,1.2469631607330207e-06,0.999,0.9,7.21838738589338e-05,1.1323629115741738,32,large,True,False,0.2455692274909158,PRUNED
468,468,1.0,2023-04-27 06:26:17.006514,2023-04-27 06:27:07.920783,0 days 00:00:50.914269,relu,0.0003947021832329994,0.999,0.9,0.0009149635511594346,4.580857939733626,64,large,False,False,0.10972813899999845,PRUNED
469,469,1.0,2023-04-27 06:27:07.921790,2023-04-27 06:27:57.376644,0 days 00:00:49.454854,tanh,5.598496012276562e-06,0.95,0.995,0.0006305054980834443,0.3108755929176288,16,small,True,False,0.13171897777080185,PRUNED
470,470,1.0,2023-04-27 06:27:57.377643,2023-04-27 06:28:46.819422,0 days 00:00:49.441779,tanh,2.4984960628447906e-06,0.999,0.9,0.0007619799594702353,0.6333286062903221,512,large,True,False,0.6720494161633935,PRUNED
471,471,1.0,2023-04-27 06:28:46.821424,2023-04-27 06:29:30.215476,0 days 00:00:43.394052,tanh,4.698726560993149e-06,0.9,0.99,0.0003638193024229261,0.4246155951608207,64,tiny,False,False,0.42013716953340613,PRUNED
472,472,63.0,2023-04-27 06:29:30.216478,2023-04-27 06:30:22.871688,0 days 00:00:52.655210,tanh,1.7177297406335378e-06,0.999,0.9,1.7579909593250762e-05,1.0293040977646688,64,large,True,False,0.3500450024597902,PRUNED
473,473,34.0,2023-04-27 06:30:22.872688,2023-04-27 06:31:17.290773,0 days 00:00:54.418085,tanh,1.2393486852700513e-05,0.999,0.9,0.000219809767039793,0.4951973427864456,32,large,False,False,0.15095687989274142,PRUNED
474,474,1.0,2023-04-27 06:31:17.292773,2023-04-27 06:32:09.574599,0 days 00:00:52.281826,relu,3.831420120316356e-06,0.95,0.9,1.3666174120279075e-05,0.3640406448842612,64,large,True,False,0.11870655739340263,PRUNED
475,475,31.0,2023-04-27 06:32:09.575600,2023-04-27 06:33:01.431675,0 days 00:00:51.856075,tanh,2.100342450095058e-05,0.999,0.98,6.701726896513287e-05,1.216986678430928,128,small,True,False,0.2691069759468107,PRUNED
476,476,23.0,2023-04-27 06:33:01.432674,2023-04-27 06:33:52.195740,0 days 00:00:50.763066,tanh,7.519919339260539e-05,0.999,0.9,0.0002408294161572307,0.7630368560037064,64,large,False,False,0.20013800303595372,PRUNED
477,477,4.0,2023-04-27 06:33:52.196741,2023-04-27 06:34:44.191987,0 days 00:00:51.995246,tanh,5.6489528896810924e-05,0.995,0.9999,0.00033011955046768877,0.5896034870824453,32,large,True,True,0.3208316462195599,PRUNED
478,478,1.0,2023-04-27 06:34:44.193986,2023-04-27 06:35:35.094345,0 days 00:00:50.900359,relu,0.008789430379306207,0.95,0.9,1.6257052711058626e-05,0.9289845435518032,64,large,True,False,0.14261334173794246,PRUNED
479,479,1.0,2023-04-27 06:35:35.095344,2023-04-27 06:36:25.919962,0 days 00:00:50.824618,tanh,1.2280287096107006e-06,0.999,0.9,1.1350880739902111e-05,0.34152602980114305,64,large,False,False,0.1256066463437531,PRUNED
480,480,90.0,2023-04-27 06:36:25.920960,2023-04-27 06:37:37.389127,0 days 00:01:11.468167,tanh,8.519748209531066e-06,0.9,0.99,2.0279388359747434e-05,0.532857045137587,512,small,True,False,0.22057155807396642,COMPLETE
481,481,1.0,2023-04-27 06:37:37.391127,2023-04-27 06:38:26.668569,0 days 00:00:49.277442,tanh,8.899352239392956e-06,0.9,0.99,0.00015219795658069656,0.5815988261678345,512,large,True,False,0.24083095379479028,PRUNED
482,482,1.0,2023-04-27 06:38:26.669572,2023-04-27 06:39:13.370772,0 days 00:00:46.701200,tanh,7.102373418526892e-06,0.9,0.99,1.9611949907809535e-05,0.5555131937721254,512,small,True,False,0.2198951734913013,PRUNED
483,483,67.0,2023-04-27 06:39:13.372776,2023-04-27 06:40:05.428539,0 days 00:00:52.055763,tanh,1.0435845101760113e-05,0.9,0.99,2.3575529565532753e-05,2.6054940756590454,512,large,True,False,0.22715999925898808,PRUNED
484,484,4.0,2023-04-27 06:40:05.429538,2023-04-27 06:40:48.428898,0 days 00:00:42.999360,tanh,1.6332735062553125e-05,0.9,0.99,1.9521099083937698e-05,0.5402543071861124,512,tiny,True,False,0.21956339382619702,PRUNED
485,485,44.0,2023-04-27 06:40:48.429897,2023-04-27 06:41:39.821862,0 days 00:00:51.391965,tanh,5.509470536560138e-06,0.9,0.99,2.7270642402422058e-05,0.5067517097229581,512,large,True,False,0.20798836073300264,PRUNED
486,486,1.0,2023-04-27 06:41:39.822862,2023-04-27 06:42:29.220088,0 days 00:00:49.397226,tanh,8.099428033970421e-06,0.9,0.99,0.0008361912010545142,0.4515311479522867,512,large,True,False,0.23625871625263123,PRUNED
487,487,1.0,2023-04-27 06:42:29.222090,2023-04-27 06:43:18.480517,0 days 00:00:49.258427,tanh,1.1528474110343394e-05,0.9,0.99,1.6269175266843153e-05,0.5200436463491304,512,large,True,False,0.2546082383412613,PRUNED
488,488,1.0,2023-04-27 06:43:18.481516,2023-04-27 06:44:04.569232,0 days 00:00:46.087716,tanh,6.689793350616019e-06,0.9,0.99,2.223145954443543e-05,0.6595986888390278,512,small,True,False,0.13437784353258997,PRUNED
489,489,1.0,2023-04-27 06:44:04.570231,2023-04-27 06:44:55.062684,0 days 00:00:50.492453,tanh,3.781411871181523e-05,0.999,0.995,0.0005507068133995892,0.30083535766395486,64,large,True,False,0.3939409162522893,PRUNED
490,490,1.0,2023-04-27 06:44:55.064685,2023-04-27 06:45:44.683194,0 days 00:00:49.618509,tanh,2.9921856034593535e-06,0.999,0.9,8.699168560151669e-05,0.6186907181709926,128,large,True,False,0.3083058220519523,PRUNED
491,491,1.0,2023-04-27 06:45:44.684195,2023-04-27 06:46:35.407863,0 days 00:00:50.723668,tanh,0.0002081643831616537,0.95,0.9,0.0011282427454819676,1.362020754200455,64,large,True,False,0.19321017099360263,PRUNED
492,492,4.0,2023-04-27 06:46:35.409860,2023-04-27 06:47:26.964119,0 days 00:00:51.554259,tanh,0.0001220360613960322,0.999,0.98,0.00012607893163634121,0.814656469046147,64,large,True,False,0.3401125474829082,PRUNED
493,493,1.0,2023-04-27 06:47:26.965121,2023-04-27 06:48:13.657376,0 days 00:00:46.692255,tanh,4.66984022212729e-06,0.999,0.9,1.4284991800762929e-05,0.867166922482909,512,small,True,False,0.4610671604668154,PRUNED
494,494,0.0,2023-04-27 06:48:13.659377,2023-04-27 06:49:08.721589,0 days 00:00:55.062212,tanh,3.9889929614601325e-06,0.9,0.99,6.159042740100308e-05,0.38582141904962125,64,large,True,False,0.28372433781719203,PRUNED
495,495,56.0,2023-04-27 06:49:08.722591,2023-04-27 06:50:00.399523,0 days 00:00:51.676932,tanh,8.890897281006632e-05,0.999,0.9,4.5238854480674974e-05,0.9791772581969898,64,large,True,False,0.22793987288799517,PRUNED
496,496,1.0,2023-04-27 06:50:00.400522,2023-04-27 06:50:43.830805,0 days 00:00:43.430283,tanh,1.3834789563613406e-05,0.99,0.9,2.0811181450942543e-05,1.0783209835537286,64,tiny,True,False,0.10593238528489822,PRUNED
497,497,114.0,2023-04-27 06:50:43.831808,2023-04-27 06:52:06.678125,0 days 00:01:22.846317,tanh,0.0001645413054258929,0.95,0.9,1.7534417580400642e-05,0.3233427086008461,128,large,True,False,0.9503927180754871,COMPLETE
498,498,47.0,2023-04-27 06:52:06.680124,2023-04-27 06:52:57.842820,0 days 00:00:51.162696,tanh,0.00018658099096265722,0.95,0.9,1.841371689544329e-05,0.32110079199933855,128,large,True,False,0.9695142845300638,PRUNED
499,499,1.0,2023-04-27 06:52:57.843818,2023-04-27 06:53:45.103951,0 days 00:00:47.260133,tanh,0.0002422196864387973,0.95,0.9,1.7500997130827826e-05,2.012922923600752,128,small,True,False,0.7534337206092308,PRUNED
500,500,1.0,2023-04-27 06:53:45.105952,2023-04-27 06:54:34.852072,0 days 00:00:49.746120,tanh,0.00016908595828482877,0.95,0.98,0.003189184089354771,0.3013865258567372,128,large,True,False,0.734618954948656,PRUNED
