,number,value,datetime_start,datetime_complete,duration,params_activation_fn,params_ent_coef,params_gae_lambda,params_gamma,params_lr,params_max_grad_norm,params_n_steps,params_net_arch,params_normalize_advantage,params_ortho_init,params_vf_coef,state
300,300,1.0,2023-04-27 03:59:22.698896,2023-04-27 04:00:13.877053,0 days 00:00:51.178157,tanh,8.194201950938877e-05,0.9999,0.995,1.4280826929397018e-05,0.8235230628876845,64,large,False,True,0.11592884303096922,PRUNED
301,301,4.0,2023-04-27 04:00:13.878051,2023-04-27 04:01:00.295205,0 days 00:00:46.417154,tanh,7.7535928542501e-05,0.99,0.999,0.00011782347232755935,0.4707612215166232,1024,small,True,False,0.2590374257432658,PRUNED
302,302,1.0,2023-04-27 04:01:00.296209,2023-04-27 04:01:54.047250,0 days 00:00:53.751041,relu,0.0002585129270268442,0.999,0.995,1.1892437983145412e-05,1.0405189035211582,64,large,True,False,0.11836070269158505,PRUNED
303,303,69.0,2023-04-27 04:01:54.049254,2023-04-27 04:02:47.633113,0 days 00:00:53.583859,tanh,4.228343980121039e-05,0.95,0.995,6.264198101390947e-05,0.40492065884961975,512,large,False,False,0.21749869354823292,PRUNED
304,304,1.0,2023-04-27 04:02:47.634104,2023-04-27 04:03:31.103263,0 days 00:00:43.469159,tanh,0.0002108434579209186,0.999,0.9999,1.7996650712949783e-05,0.9820326201890873,64,tiny,True,False,0.2782976246129975,PRUNED
305,305,4.0,2023-04-27 04:03:31.104266,2023-04-27 04:04:20.962307,0 days 00:00:49.858041,tanh,0.00015309299841126118,0.995,0.99,7.854105049911652e-05,0.9208641275518173,128,large,True,True,0.24389548222749868,PRUNED
306,306,0.0,2023-04-27 04:04:20.963306,2023-04-27 04:05:16.677107,0 days 00:00:55.713801,relu,0.00035235662947042865,0.999,0.995,1.3775572275162874e-05,0.4310864244399512,64,large,False,False,0.12373630124778576,PRUNED
307,307,0.0,2023-04-27 04:05:16.678104,2023-04-27 04:06:08.976154,0 days 00:00:52.298050,tanh,9.964197912587469e-05,0.95,0.999,1.1398165698233119e-05,0.6837640022480763,32,small,True,False,0.1115903003283214,PRUNED
308,308,0.0,2023-04-27 04:06:08.977153,2023-04-27 04:07:06.256413,0 days 00:00:57.279260,tanh,1.6209673745565346e-06,0.999,0.9,1.58371652525529e-05,1.1395011480137545,64,large,True,False,0.16439527023693037,PRUNED
309,309,1.0,2023-04-27 04:07:06.257417,2023-04-27 04:07:55.508321,0 days 00:00:49.250904,tanh,0.00019399303947704292,0.9999,0.9,1.2542399811725705e-05,0.3568089250193362,1024,large,False,False,0.3216575919781287,PRUNED
310,310,1.0,2023-04-27 04:07:55.509321,2023-04-27 04:08:44.864201,0 days 00:00:49.354880,tanh,3.278293747622366e-06,0.999,0.9,1.980756955448689e-05,0.7799378782999199,256,large,True,False,0.15081306939825012,PRUNED
311,311,1.0,2023-04-27 04:08:44.866206,2023-04-27 04:09:35.420257,0 days 00:00:50.554051,relu,0.00026056512018351335,0.999,0.999,1.477549114167795e-05,0.3201636784554173,64,large,True,True,0.3042426028418223,PRUNED
312,312,1.0,2023-04-27 04:09:35.421258,2023-04-27 04:10:24.885701,0 days 00:00:49.464443,tanh,2.1635111603206815e-06,0.95,0.9,1.0139603893123354e-05,0.5775728255423259,16,small,False,False,0.2267007757297829,PRUNED
313,313,1.0,2023-04-27 04:10:24.886700,2023-04-27 04:11:16.757540,0 days 00:00:51.870840,tanh,2.746351547186149e-06,0.999,0.9,4.642837124228525e-05,0.3623257761715769,64,large,True,False,0.13390579235848085,PRUNED
314,314,1.0,2023-04-27 04:11:16.759538,2023-04-27 04:12:06.704605,0 days 00:00:49.945067,tanh,2.4089784086420316e-05,0.9999,0.999,1.6692180572211266e-05,0.8609096075836895,128,large,True,False,0.36697101699047313,PRUNED
315,315,1.0,2023-04-27 04:12:06.705605,2023-04-27 04:12:49.957206,0 days 00:00:43.251601,relu,0.00012063464763946952,0.999,0.9,1.244174277818904e-05,0.5217266135344254,512,tiny,False,False,0.13933246469046662,PRUNED
316,316,1.0,2023-04-27 04:12:49.959207,2023-04-27 04:13:40.863406,0 days 00:00:50.904199,tanh,1.5014291158508401e-06,0.999,0.9,1.0042144902926836e-05,0.3809771663554081,64,large,True,True,0.11478265665523674,PRUNED
317,317,21.0,2023-04-27 04:13:40.864406,2023-04-27 04:14:36.966181,0 days 00:00:56.101775,tanh,4.317490967229736e-06,0.95,0.99,1.9315644495081724e-05,1.0887517782065301,32,large,True,False,0.25384862455563784,PRUNED
318,318,1.0,2023-04-27 04:14:36.967183,2023-04-27 04:15:24.045044,0 days 00:00:47.077861,tanh,1.8991044281610863e-06,0.999,0.999,0.0003220515628759703,0.3016882216992639,64,small,False,False,0.10867295055407401,PRUNED
319,319,50.0,2023-04-27 04:15:24.046046,2023-04-27 04:16:14.702047,0 days 00:00:50.656001,relu,3.504812681026525e-06,0.9,0.9,1.3722429444182324e-05,0.7269581362289416,1024,large,True,False,0.124088511005271,PRUNED
320,320,4.0,2023-04-27 04:16:14.704048,2023-04-27 04:17:05.568694,0 days 00:00:50.864646,tanh,5.744636272534694e-05,0.9999,0.9,2.5342316677397303e-05,1.363371389367339,64,large,True,False,0.105361441393512,PRUNED
321,321,1.0,2023-04-27 04:17:05.569691,2023-04-27 04:17:56.015439,0 days 00:00:50.445748,tanh,0.00018327102017287166,0.999,0.9,1.1497399310474253e-05,0.641675540665461,128,large,False,True,0.28810039359190803,PRUNED
322,322,1.0,2023-04-27 04:17:56.017438,2023-04-27 04:18:47.077034,0 days 00:00:51.059596,tanh,2.50713405220434e-06,0.999,0.999,1.590982907479406e-05,0.4164228150462256,64,large,True,False,0.11990597604795594,PRUNED
323,323,68.0,2023-04-27 04:18:47.078034,2023-04-27 04:19:35.358000,0 days 00:00:48.279966,relu,4.704691481120589e-06,0.95,0.995,3.0036203886747873e-05,0.336490708078581,64,small,True,False,0.20233866299222986,PRUNED
324,324,51.0,2023-04-27 04:19:35.358998,2023-04-27 04:20:25.668838,0 days 00:00:50.309840,tanh,1.527432936587469e-06,0.999,0.9,1.2911436544826721e-05,0.3743016843137134,512,large,False,False,0.23782617873339335,PRUNED
325,325,1.0,2023-04-27 04:20:25.669835,2023-04-27 04:21:16.066007,0 days 00:00:50.396172,tanh,4.585520448435331e-05,0.99,0.9,1.1206168451815331e-05,1.2128811507750898,1024,large,True,False,0.18177628655234154,PRUNED
326,326,1.0,2023-04-27 04:21:16.067007,2023-04-27 04:22:08.452558,0 days 00:00:52.385551,tanh,7.358907646148371e-06,0.995,0.999,2.2283314319670775e-05,0.48099547003795395,32,large,True,True,0.11314625536604432,PRUNED
327,327,4.0,2023-04-27 04:22:08.453558,2023-04-27 04:22:59.618004,0 days 00:00:51.164446,tanh,0.16728920173347298,0.999,0.9,1.8284326631339546e-05,0.31726502113483995,64,large,False,False,0.26609443176878467,PRUNED
328,328,1.0,2023-04-27 04:22:59.620005,2023-04-27 04:23:43.023145,0 days 00:00:43.403140,relu,0.00023699997331330354,0.98,0.9,0.00010150531723467376,1.5308867091409095,64,tiny,True,False,0.103772476409611,PRUNED
329,329,70.0,2023-04-27 04:23:43.024147,2023-04-27 04:24:32.903118,0 days 00:00:49.878971,tanh,3.6254889458440432e-06,0.9999,0.9,0.0004034193306042464,0.3546993427209021,128,small,True,False,0.10991895499175361,PRUNED
330,330,4.0,2023-04-27 04:24:32.904120,2023-04-27 04:25:23.754911,0 days 00:00:50.850791,tanh,1.8920667221778397e-06,0.9,0.9999,1.4147003996620086e-05,0.4499500557785885,64,large,False,False,0.15713858132437994,PRUNED
331,331,4.0,2023-04-27 04:25:23.756910,2023-04-27 04:26:15.815377,0 days 00:00:52.058467,tanh,0.0005958893650825998,0.95,0.999,3.775176149702858e-05,0.3992082292879262,32,large,True,True,0.9423525963187358,PRUNED
332,332,1.0,2023-04-27 04:26:15.816377,2023-04-27 04:27:06.462050,0 days 00:00:50.645673,relu,1.682271885796961e-05,0.999,0.99,1.1496385054280727e-05,1.8899409551552886,64,large,True,False,0.19393655067160032,PRUNED
333,333,1.0,2023-04-27 04:27:06.463049,2023-04-27 04:27:55.595752,0 days 00:00:49.132703,tanh,0.00030535155851842583,0.999,0.9,1.6306595352026307e-05,1.7097508917785262,512,large,False,False,0.21176655011280512,PRUNED
334,334,1.0,2023-04-27 04:27:55.597750,2023-04-27 04:28:41.818983,0 days 00:00:46.221233,tanh,1.3603652954873364e-05,0.999,0.9,1.374793363731822e-05,0.9548090341746728,1024,small,True,False,0.2299471408044492,PRUNED
335,335,55.0,2023-04-27 04:28:41.820985,2023-04-27 04:29:33.747477,0 days 00:00:51.926492,tanh,2.6932097760035086e-06,0.98,0.999,1.0003132212441425e-05,0.33442543263915203,64,large,False,False,0.11801305879120495,PRUNED
336,336,1.0,2023-04-27 04:29:33.748477,2023-04-27 04:30:24.396951,0 days 00:00:50.648474,relu,0.00017363158523243854,0.95,0.9,0.0014682457666884154,1.8098729615574345,64,large,True,True,0.13032091184082423,PRUNED
337,337,0.0,2023-04-27 04:30:24.398943,2023-04-27 04:31:21.420270,0 days 00:00:57.021327,tanh,5.402805495137817e-06,0.9999,0.9,1.9921778240936888e-05,0.5991227240338479,128,large,True,False,0.2461170805502437,PRUNED
338,338,47.0,2023-04-27 04:31:21.422271,2023-04-27 04:32:17.656649,0 days 00:00:56.234378,tanh,3.546723347515499e-05,0.999,0.995,1.2586747196890818e-05,0.3001964319061036,64,large,False,False,0.10728275910824485,PRUNED
339,339,4.0,2023-04-27 04:32:17.658650,2023-04-27 04:33:05.933153,0 days 00:00:48.274503,tanh,9.067915928121844e-05,0.9,0.999,2.6958284283471138e-05,0.3524077233710584,32,small,True,False,0.1448000448848052,PRUNED
340,340,1.0,2023-04-27 04:33:05.935151,2023-04-27 04:33:55.422391,0 days 00:00:49.487240,tanh,1.3487785452359947e-06,0.999,0.9,5.105522773084488e-05,1.032546401794821,256,large,True,False,0.10205573083149647,PRUNED
341,341,19.0,2023-04-27 04:33:55.423393,2023-04-27 04:34:38.894720,0 days 00:00:43.471327,relu,9.500384307775255e-06,0.999,0.9,1.5497691292382845e-05,0.5085679069220415,64,tiny,False,True,0.12172614598903343,PRUNED
342,342,4.0,2023-04-27 04:34:38.895719,2023-04-27 04:35:28.005743,0 days 00:00:49.110024,tanh,2.2309503571683945e-06,0.95,0.9,2.31005090136299e-05,0.39305886496850034,1024,large,True,False,0.11414133088208776,PRUNED
343,343,1.0,2023-04-27 04:35:28.006744,2023-04-27 04:36:21.955835,0 days 00:00:53.949091,tanh,0.00013232421223251782,0.98,0.999,0.00019090568004820642,0.9050186624789132,16,large,True,False,0.2521942273010962,PRUNED
344,344,44.0,2023-04-27 04:36:21.956832,2023-04-27 04:37:38.125661,0 days 00:01:16.168829,tanh,2.09389823851826e-05,0.999,0.9,0.00014372907616145642,1.379769148724035,64,large,False,False,0.10754176810053301,COMPLETE
345,345,55.0,2023-04-27 04:37:38.127665,2023-04-27 04:38:28.034225,0 days 00:00:49.906560,relu,6.091970805605205e-06,0.9999,0.99,1.1430065782736672e-05,1.2604609716688902,512,small,True,False,0.32283353627594275,PRUNED
346,346,4.0,2023-04-27 04:38:28.035226,2023-04-27 04:39:17.851907,0 days 00:00:49.816681,tanh,3.2897888579342074e-06,0.999,0.9,1.7252924757806044e-05,0.7925282291087864,128,large,True,True,0.2694566967335641,PRUNED
347,347,1.0,2023-04-27 04:39:17.852907,2023-04-27 04:40:08.395766,0 days 00:00:50.542859,tanh,4.3212400053936784e-06,0.999,0.999,1.4175536142179242e-05,0.4224048752880199,64,large,False,False,0.180562930550788,PRUNED
348,348,73.0,2023-04-27 04:40:08.396765,2023-04-27 04:41:29.919713,0 days 00:01:21.522948,tanh,1.6617964724637533e-06,0.95,0.9,1.0039146861433894e-05,0.3705549297646441,64,large,True,False,0.11273552454326295,COMPLETE
349,349,33.0,2023-04-27 04:41:29.921716,2023-04-27 04:42:20.837824,0 days 00:00:50.916108,tanh,1.2522749406000187e-06,0.95,0.9,1.1232948474279817e-05,0.32383858231539703,64,large,True,False,0.1159109669541111,PRUNED
350,350,4.0,2023-04-27 04:42:20.838825,2023-04-27 04:43:09.519940,0 days 00:00:48.681115,relu,1.886518497402791e-06,0.95,0.9,1.237154796566641e-05,0.6691637824993906,32,small,True,False,0.21755555628384668,PRUNED
351,351,55.0,2023-04-27 04:43:09.521941,2023-04-27 04:44:02.317780,0 days 00:00:52.795839,tanh,1.6522724843540168e-06,0.95,0.995,1.0304295507485018e-05,0.3670408310207096,1024,large,False,False,0.12619252326405647,PRUNED
352,352,1.0,2023-04-27 04:44:02.318775,2023-04-27 04:44:53.085536,0 days 00:00:50.766761,tanh,6.981233687481126e-05,0.95,0.999,7.869945266371119e-05,0.3427944948575285,64,large,True,True,0.13146509614879842,PRUNED
353,353,1.0,2023-04-27 04:44:53.087536,2023-04-27 04:45:43.436837,0 days 00:00:50.349301,tanh,1.3446180826051472e-06,0.95,0.9,1.0092592820356309e-05,1.151993696303886,64,large,True,False,0.17256520003262701,PRUNED
354,354,1.0,2023-04-27 04:45:43.437837,2023-04-27 04:46:26.953642,0 days 00:00:43.515805,relu,8.237972144300146e-06,0.95,0.9,1.3062095607256247e-05,0.31838110454974367,128,tiny,False,False,0.12067316273554517,PRUNED
355,355,56.0,2023-04-27 04:46:26.954641,2023-04-27 04:47:21.631541,0 days 00:00:54.676900,tanh,0.00029950706382261664,0.98,0.9999,4.239069590065295e-05,0.3789708154775558,64,large,True,False,0.11248777811296863,PRUNED
356,356,1.0,2023-04-27 04:47:21.632541,2023-04-27 04:48:08.206047,0 days 00:00:46.573506,tanh,5.217766059173779e-05,0.9,0.9,1.1847397715725406e-05,0.995355930136936,512,small,True,False,0.22518333708899935,PRUNED
357,357,58.0,2023-04-27 04:48:08.208054,2023-04-27 04:49:01.193848,0 days 00:00:52.985794,tanh,2.364673804810988e-06,0.95,0.999,1.4781178452260357e-05,0.3470336848832393,32,large,False,True,0.1002930806380184,PRUNED
358,358,1.0,2023-04-27 04:49:01.194848,2023-04-27 04:49:51.864861,0 days 00:00:50.670013,tanh,0.00023166497710109334,0.9999,0.9,1.266366568242537e-05,1.5093989997051591,64,large,True,False,0.3037668025442847,PRUNED
359,359,1.0,2023-04-27 04:49:51.865860,2023-04-27 04:50:40.712667,0 days 00:00:48.846807,relu,0.00011023224208570916,0.99,0.9,1.166056898902229e-05,0.4411037383348626,1024,large,True,False,0.11003061893569217,PRUNED
360,360,74.0,2023-04-27 04:50:40.713668,2023-04-27 04:52:03.995842,0 days 00:01:23.282174,tanh,2.609318332105993e-05,0.995,0.99,1.5035955385244106e-05,0.7243373331204334,64,large,False,False,0.2782801378670634,COMPLETE
361,361,7.0,2023-04-27 04:52:03.997843,2023-04-27 04:52:55.569352,0 days 00:00:51.571509,tanh,2.4926568955159094e-05,0.98,0.99,1.7215062057329805e-05,0.7160151618793453,64,large,False,False,0.28895649365799064,PRUNED
362,362,1.0,2023-04-27 04:52:55.570353,2023-04-27 04:53:43.213759,0 days 00:00:47.643406,tanh,9.454153799587181e-06,0.995,0.999,1.507362051036956e-05,0.7104298918527517,64,small,False,False,0.2760596148630013,PRUNED
363,363,0.0,2023-04-27 04:53:43.214758,2023-04-27 04:54:38.449999,0 days 00:00:55.235241,relu,3.5443718543312205e-05,0.995,0.99,1.9272766147247357e-05,0.8510627006417448,64,large,False,True,0.2541068476793502,PRUNED
364,364,1.0,2023-04-27 04:54:38.451001,2023-04-27 04:55:29.242242,0 days 00:00:50.791241,tanh,1.2422680005265686e-05,0.995,0.999,1.3477258130060089e-05,0.32681501303255767,64,large,False,False,0.23937689953006802,PRUNED
365,365,0.0,2023-04-27 04:55:29.244243,2023-04-27 04:56:24.667633,0 days 00:00:55.423390,tanh,4.758435844772309e-05,0.995,0.99,0.0058619434672886545,0.889811497095319,64,large,False,False,0.25868941499905945,PRUNED
366,366,1.0,2023-04-27 04:56:24.668631,2023-04-27 04:57:15.620407,0 days 00:00:50.951776,tanh,1.9320248778587586e-05,0.995,0.99,1.6107303625500325e-05,1.0775483252958649,64,large,False,False,0.16152546545226457,PRUNED
367,367,14.0,2023-04-27 04:57:15.621407,2023-04-27 04:58:17.546857,0 days 00:01:01.925450,tanh,7.09196556177749e-05,0.995,0.99,5.2659685295057834e-05,0.769198055856494,64,tiny,False,False,0.27047688106129963,COMPLETE
368,368,25.0,2023-04-27 04:58:17.548855,2023-04-27 04:59:04.525723,0 days 00:00:46.976868,relu,2.868979865459513e-05,0.999,0.995,1.4555326196789529e-05,0.6105156809538733,128,small,False,True,0.1373955335774295,PRUNED
369,369,1.0,2023-04-27 04:59:04.527724,2023-04-27 04:59:55.373663,0 days 00:00:50.845939,tanh,6.660556721985795e-06,0.9,0.98,0.00026730277775209127,0.6583972523305516,64,large,False,False,0.15071950384998523,PRUNED
370,370,1.0,2023-04-27 04:59:55.374661,2023-04-27 05:00:47.160337,0 days 00:00:51.785676,tanh,1.6111934186565343e-05,0.9999,0.99,1.0055160763423865e-05,0.8157007774914762,32,large,False,False,0.11861700010082737,PRUNED
371,371,10.0,2023-04-27 05:00:47.161336,2023-04-27 05:01:45.356404,0 days 00:00:58.195068,tanh,1.0308068693446477e-06,0.999,0.99,3.1680152629159076e-05,0.5758171292914362,64,large,False,False,0.12414236908494163,PRUNED
372,372,1.0,2023-04-27 05:01:45.357403,2023-04-27 05:02:36.239049,0 days 00:00:50.881646,relu,1.5379465434403892e-06,0.98,0.999,1.7842911921968314e-05,0.3633850509612225,512,large,True,False,0.2810333042261806,PRUNED
373,373,4.0,2023-04-27 05:02:36.240049,2023-04-27 05:03:23.827143,0 days 00:00:47.587094,tanh,0.016838423381667505,0.995,0.9,2.0971454875681385e-05,0.3113037517549506,64,small,False,True,0.36668367839051763,PRUNED
374,374,1.0,2023-04-27 05:03:23.828140,2023-04-27 05:04:14.310376,0 days 00:00:50.482236,tanh,5.155869916829109e-06,0.9999,0.999,0.0001031955094321254,0.536382599869619,64,large,True,False,0.5063346764216909,PRUNED
375,375,64.0,2023-04-27 05:04:14.311374,2023-04-27 05:05:05.368429,0 days 00:00:51.057055,tanh,1.1665211693427823e-05,0.999,0.9,0.00039552697536095503,0.562533125723091,256,large,True,False,0.23770539745771052,PRUNED
376,376,52.0,2023-04-27 05:05:05.369429,2023-04-27 05:06:29.569179,0 days 00:01:24.199750,relu,0.0022071606607010734,0.9,0.99,1.3290597071950204e-05,0.7552997830080307,128,large,False,False,0.20459831261252884,COMPLETE
377,377,1.0,2023-04-27 05:06:29.571237,2023-04-27 05:07:22.095949,0 days 00:00:52.524712,tanh,0.00017428189604090338,0.999,0.9,1.1236582173881179e-05,0.3363515113310697,64,large,True,False,0.11486834776542751,PRUNED
378,378,1.0,2023-04-27 05:07:22.097942,2023-04-27 05:08:10.652245,0 days 00:00:48.554303,tanh,9.129309124363142e-05,0.999,0.999,1.5733529414573802e-05,0.6257966409779734,32,small,False,True,0.24674956247849197,PRUNED
379,379,1.0,2023-04-27 05:08:10.653243,2023-04-27 05:09:04.391690,0 days 00:00:53.738447,tanh,0.00038069697161011997,0.98,0.9,1.2623656884884189e-05,2.0957540464276607,16,large,True,False,0.14411994744357806,PRUNED
380,380,4.0,2023-04-27 05:09:04.393690,2023-04-27 05:09:47.754192,0 days 00:00:43.360502,tanh,2.2919382302501334e-05,0.9999,0.9,2.4124309553621646e-05,0.9617547097920871,64,tiny,True,False,0.19249215175467668,PRUNED
381,381,1.0,2023-04-27 05:09:47.755194,2023-04-27 05:10:38.421179,0 days 00:00:50.665985,relu,7.112239192070274e-06,0.999,0.995,1.838346833859342e-05,0.4879386466232385,64,large,False,False,0.26500809262796593,PRUNED
382,382,67.0,2023-04-27 05:10:38.423179,2023-04-27 05:11:32.541191,0 days 00:00:54.118012,tanh,4.283238336874645e-06,0.999,0.98,1.1265414817709328e-05,0.35097599541410657,128,large,True,False,0.12693137554792167,PRUNED
383,383,8.0,2023-04-27 05:11:32.543194,2023-04-27 05:12:23.274320,0 days 00:00:50.731126,tanh,6.37906127569378e-05,0.9,0.9,1.4492802833511713e-05,0.3143549125004773,64,large,True,True,0.1194030239036712,PRUNED
384,384,4.0,2023-04-27 05:12:23.275321,2023-04-27 05:13:09.494503,0 days 00:00:46.219182,tanh,1.8198695247614235e-06,0.999,0.999,3.542515527814131e-05,0.3724975206540003,512,small,False,False,0.3335430395159501,PRUNED
385,385,1.0,2023-04-27 05:13:09.495501,2023-04-27 05:14:00.341101,0 days 00:00:50.845600,relu,3.0142962475533206e-06,0.98,0.9,7.533310151364724e-05,0.33574661824075624,64,large,True,False,0.11281346955354493,PRUNED
386,386,28.0,2023-04-27 05:14:00.343100,2023-04-27 05:14:52.557025,0 days 00:00:52.213925,tanh,0.00013258991883614434,0.999,0.9999,0.002374948756697834,0.4008457706018256,32,large,True,False,0.23152928354040517,PRUNED
387,387,1.0,2023-04-27 05:14:52.558027,2023-04-27 05:15:42.909660,0 days 00:00:50.351633,tanh,1.1993538727701163e-06,0.9999,0.9,1.276996135132408e-05,0.8825495959026567,64,large,False,False,0.10836213234316192,PRUNED
388,388,16.0,2023-04-27 05:15:42.910662,2023-04-27 05:16:34.009676,0 days 00:00:51.099014,tanh,1.414106778358373e-05,0.999,0.999,1.570931393350665e-05,1.7427891995311369,64,large,True,True,0.16711896577262267,PRUNED
389,389,1.0,2023-04-27 05:16:34.010676,2023-04-27 05:17:21.083749,0 days 00:00:47.073073,relu,3.539929334222118e-05,0.99,0.99,1.1157469257863571e-05,0.6883907122327269,128,small,True,False,0.2175579828165056,PRUNED
390,390,1.0,2023-04-27 05:17:21.085749,2023-04-27 05:18:12.574833,0 days 00:00:51.489084,tanh,0.021854390927893732,0.995,0.9,0.00014267066253415649,0.30017948701019914,64,large,False,False,0.30112661127932566,PRUNED
391,391,52.0,2023-04-27 05:18:12.576834,2023-04-27 05:19:29.140158,0 days 00:01:16.563324,tanh,0.00021612221571970565,0.999,0.9,5.9573237424549897e-05,1.5778340622131795,512,large,True,False,0.31727697591122733,COMPLETE
392,392,59.0,2023-04-27 05:19:29.142160,2023-04-27 05:20:13.109367,0 days 00:00:43.967207,tanh,0.08751285263847616,0.98,0.999,1.907085416440758e-05,0.8203933205788442,64,tiny,False,False,0.12914321895355216,PRUNED
393,393,72.0,2023-04-27 05:20:13.110368,2023-04-27 05:21:34.875814,0 days 00:01:21.765446,tanh,3.5600661816004947e-06,0.999,0.9,1.0239021767262338e-05,1.020900643504522,32,large,True,False,0.13488236608702617,COMPLETE
394,394,4.0,2023-04-27 05:21:34.877815,2023-04-27 05:22:27.048495,0 days 00:00:52.170680,relu,5.784019508076637e-06,0.999,0.9,1.0016841259427405e-05,1.022895766602139,32,large,True,True,0.28332873839629,PRUNED
395,395,66.0,2023-04-27 05:22:27.050500,2023-04-27 05:23:47.750412,0 days 00:01:20.699912,tanh,8.9865367698927e-06,0.999,0.9,1.0166954281986562e-05,0.933553148802575,32,large,True,False,0.13552937513192564,COMPLETE
396,396,1.0,2023-04-27 05:23:47.752415,2023-04-27 05:24:35.613201,0 days 00:00:47.860786,tanh,1.1434467437529778e-05,0.999,0.9,1.0161361315625629e-05,0.9021043012583896,32,small,False,False,0.136896625808329,PRUNED
397,397,1.0,2023-04-27 05:24:35.614201,2023-04-27 05:25:27.428284,0 days 00:00:51.814083,tanh,9.193818969465925e-06,0.999,0.9,0.0004886590586642477,1.0078150232176692,32,large,True,False,0.14075825425807856,PRUNED
398,398,61.0,2023-04-27 05:25:27.430284,2023-04-27 05:26:23.139361,0 days 00:00:55.709077,tanh,7.838268051721114e-06,0.999,0.9,1.1438339200320118e-05,0.9126950319410257,32,large,True,False,0.13343254018142445,PRUNED
399,399,0.0,2023-04-27 05:26:23.140359,2023-04-27 05:27:19.535730,0 days 00:00:56.395371,relu,1.4416793739656522e-06,0.999,0.9,1.296654259037216e-05,0.9867540727479672,32,large,False,False,0.3808526390538811,PRUNED
