,number,value,datetime_start,datetime_complete,duration,params_activation_fn,params_ent_coef,params_gae_lambda,params_gamma,params_lr,params_max_grad_norm,params_n_steps,params_net_arch,params_normalize_advantage,params_ortho_init,params_vf_coef,state
904,904,26.0,2023-04-27 13:24:19.513050,2023-04-27 13:25:10.956780,0 days 00:00:51.443730,tanh,0.0076611120520169215,0.9,0.9,0.004697677893123743,3.5381584702912017,1024,large,False,False,0.16495080273337587,PRUNED
905,905,6.0,2023-04-27 13:25:10.957778,2023-04-27 13:26:03.539583,0 days 00:00:52.581805,tanh,0.00013502726326175034,0.95,0.99,0.00026037536300338134,0.8454468599521591,64,large,True,False,0.8185215840090674,PRUNED
906,906,24.0,2023-04-27 13:26:03.540584,2023-04-27 13:27:16.517992,0 days 00:01:12.977408,relu,3.8379282768200585e-05,0.999,0.9,3.380048480713936e-05,0.559273517181141,128,small,False,True,0.24551289685287953,COMPLETE
907,907,1.0,2023-04-27 13:27:16.520992,2023-04-27 13:28:07.781742,0 days 00:00:51.260750,tanh,0.001970827567854521,0.95,0.9,0.00045758885267362917,0.6354224982443311,256,large,True,False,0.6155597148842199,PRUNED
908,908,1.0,2023-04-27 13:28:07.783741,2023-04-27 13:29:00.585817,0 days 00:00:52.802076,tanh,0.0013699950059903184,0.995,0.98,1.3946131243537102e-05,0.387065121202807,64,large,False,False,0.7183303848898337,PRUNED
909,909,44.0,2023-04-27 13:29:00.588813,2023-04-27 13:29:54.748872,0 days 00:00:54.160059,tanh,0.0002736337844519712,0.999,0.9,1.9181957124346344e-05,1.3185376341675785,32,large,True,False,0.12681725726459991,PRUNED
910,910,0.0,2023-04-27 13:29:54.749872,2023-04-27 13:30:47.747691,0 days 00:00:52.997819,relu,0.0010319833555930925,0.9,0.99,5.8912794223312864e-05,0.3534094286802829,128,small,True,False,0.11306357446922508,PRUNED
911,911,72.0,2023-04-27 13:30:47.748691,2023-04-27 13:32:23.556363,0 days 00:01:35.807672,tanh,2.289910271938257e-05,0.98,0.9,1.1784809107437485e-05,0.4242132904727421,16,large,False,False,0.34089055278907265,COMPLETE
912,912,77.0,2023-04-27 13:32:23.558364,2023-04-27 13:33:25.069169,0 days 00:01:01.510805,tanh,0.009872866329860576,0.999,0.995,0.004032231736913672,3.0281067797657935,64,large,True,False,0.26972314653936974,PRUNED
913,913,1.0,2023-04-27 13:33:25.071170,2023-04-27 13:34:11.449843,0 days 00:00:46.378673,relu,0.04398554527830206,0.95,0.9,9.268497197216642e-05,0.7803628324134104,512,tiny,False,False,0.20922564449442244,PRUNED
914,914,7.0,2023-04-27 13:34:11.451841,2023-04-27 13:35:03.045778,0 days 00:00:51.593937,tanh,0.11485619384392062,0.9999,0.98,0.0009107753141541106,0.5183977143206839,64,large,True,True,0.22686656944673683,PRUNED
915,915,1.0,2023-04-27 13:35:03.047778,2023-04-27 13:35:53.878139,0 days 00:00:50.830361,tanh,0.0054813064148781995,0.999,0.9999,1.0048140466915429e-05,0.3315786547869349,128,small,False,False,0.9959885620999538,PRUNED
916,916,1.0,2023-04-27 13:35:53.880138,2023-04-27 13:36:47.474759,0 days 00:00:53.594621,tanh,2.9491507928447308e-05,0.95,0.9,1.57594890641758e-05,0.4048740143986209,64,large,True,False,0.9089979757172454,PRUNED
917,917,1.0,2023-04-27 13:36:47.476764,2023-04-27 13:37:40.321679,0 days 00:00:52.844915,relu,0.07244120735429956,0.9,0.99,0.00011742896541512415,0.601127298016404,512,large,False,False,0.5578083586356297,PRUNED
918,918,62.0,2023-04-27 13:37:40.322681,2023-04-27 13:38:35.662998,0 days 00:00:55.340317,tanh,5.891949115815732e-05,0.999,0.9,0.0003116163557702576,0.3658031749423791,128,large,True,False,0.6536146206654092,PRUNED
919,919,1.0,2023-04-27 13:38:35.664999,2023-04-27 13:39:23.752735,0 days 00:00:48.087736,tanh,0.035894617534777615,0.95,0.9,0.001337954714965512,0.3121278527977602,64,small,True,False,0.2531444358033044,PRUNED
920,920,1.0,2023-04-27 13:39:23.754733,2023-04-27 13:40:17.057818,0 days 00:00:53.303085,tanh,1.3745358540813429e-05,0.999,0.98,1.3324512736921604e-05,1.0584511254285784,32,large,False,False,0.8453560160671997,PRUNED
921,921,0.0,2023-04-27 13:40:17.059822,2023-04-27 13:41:11.903386,0 days 00:00:54.843564,relu,0.008384149485030558,0.98,0.9,1.79161464992564e-05,0.9934398474236877,1024,large,True,False,0.10876080330684204,PRUNED
922,922,1.0,2023-04-27 13:41:11.905387,2023-04-27 13:42:05.755105,0 days 00:00:53.849718,tanh,0.009830143059841116,0.99,0.99,0.0005501319415577291,0.34380177798954725,64,large,False,True,0.19005851475165825,PRUNED
923,923,1.0,2023-04-27 13:42:05.756102,2023-04-27 13:42:56.935916,0 days 00:00:51.179814,tanh,0.011715211584441573,0.9,0.9,2.1877986918598156e-05,3.831368200484442,128,large,True,False,0.2004086735674899,PRUNED
924,924,1.0,2023-04-27 13:42:56.936915,2023-04-27 13:43:50.142768,0 days 00:00:53.205853,tanh,0.002675759146852927,0.999,0.9,8.109109062688105e-05,0.9144967191318548,512,small,False,False,0.48774670192190345,PRUNED
925,925,7.0,2023-04-27 13:43:50.144769,2023-04-27 13:44:53.501204,0 days 00:01:03.356435,relu,0.0010395473895638396,0.995,0.98,0.0020933679698248546,0.7154502228277481,64,large,True,False,0.30826412558129973,PRUNED
926,926,1.0,2023-04-27 13:44:53.504200,2023-04-27 13:45:42.875933,0 days 00:00:49.371733,tanh,0.00017565271966242844,0.95,0.995,0.0037500669239002417,2.7790714232828924,128,tiny,False,False,0.797613566120517,PRUNED
927,927,1.0,2023-04-27 13:45:42.877928,2023-04-27 13:46:42.190406,0 days 00:00:59.312478,tanh,7.09949562335835e-05,0.999,0.9,0.009904068053326238,0.44842591718336233,64,large,True,False,0.14537225058079975,PRUNED
928,928,1.0,2023-04-27 13:46:42.192406,2023-04-27 13:47:44.555856,0 days 00:01:02.363450,relu,0.05893481359867531,0.95,0.99,0.00829223639486015,2.4548306286956296,32,large,True,False,0.1321337258361397,PRUNED
929,929,8.0,2023-04-27 13:47:44.557857,2023-04-27 13:48:41.573632,0 days 00:00:57.015775,tanh,0.14262471519622102,0.9999,0.9999,0.0007569255954489935,2.9685102787847177,64,small,False,False,0.6901042556619962,PRUNED
930,930,1.0,2023-04-27 13:48:41.576083,2023-04-27 13:49:43.031037,0 days 00:01:01.454954,tanh,0.010120243969491223,0.9,0.9,0.0010297641725696717,0.3890964906138914,128,large,True,True,0.750276551130872,PRUNED
931,931,1.0,2023-04-27 13:49:43.033037,2023-04-27 13:50:44.138191,0 days 00:01:01.105154,tanh,0.02611872610624333,0.999,0.9,5.263518518641718e-05,0.30109683938397935,512,large,False,False,0.12278822499715583,PRUNED
932,932,29.0,2023-04-27 13:50:44.140192,2023-04-27 13:52:28.698857,0 days 00:01:44.558665,relu,0.035093101257672524,0.98,0.98,1.1644836538192592e-05,1.4256889719757517,64,large,True,False,0.11724680097623681,COMPLETE
933,933,24.0,2023-04-27 13:52:28.701856,2023-04-27 13:53:28.105310,0 days 00:00:59.403454,tanh,3.451196763590667e-06,0.999,0.9,1.4788655640132546e-05,3.4287544011009703,128,small,False,False,0.2822612907624201,PRUNED
934,934,56.0,2023-04-27 13:53:28.107810,2023-04-27 13:54:33.192306,0 days 00:01:05.084496,tanh,0.0006789387334191847,0.95,0.99,0.00017565773148473754,2.7729618581660715,64,large,True,False,0.46627179582721545,PRUNED
935,935,77.0,2023-04-27 13:54:33.194304,2023-04-27 13:55:40.606241,0 days 00:01:07.411937,tanh,0.031509418148834484,0.999,0.9,0.00036538195891743045,2.2927829555200883,1024,large,False,False,0.23594827838908977,PRUNED
936,936,1.0,2023-04-27 13:55:40.608239,2023-04-27 13:56:51.121714,0 days 00:01:10.513475,relu,9.23399827163907e-05,0.9,0.9,1.2530918405044252e-05,2.161333682797444,256,large,True,False,0.5869016013606798,PRUNED
937,937,1.0,2023-04-27 13:56:51.123721,2023-04-27 13:57:50.118176,0 days 00:00:58.994455,tanh,0.007357364750396773,0.95,0.98,0.0017028719321234,3.238326145478523,512,small,False,False,0.10565640598276808,PRUNED
938,938,7.0,2023-04-27 13:57:50.120176,2023-04-27 13:58:42.772727,0 days 00:00:52.652551,tanh,0.1798827348829785,0.999,0.9,1.0014811028879012e-05,0.559423676159357,64,tiny,True,True,0.21824308525802452,PRUNED
939,939,1.0,2023-04-27 13:58:42.774726,2023-04-27 13:59:41.782010,0 days 00:00:59.007284,tanh,5.0885384280603735e-05,0.995,0.99,0.0002001117825373599,0.48578910578075296,128,large,True,False,0.13852967744711608,PRUNED
940,940,1.0,2023-04-27 13:59:41.783029,2023-04-27 14:00:45.794787,0 days 00:01:04.011758,relu,1.0665738348995271e-05,0.95,0.999,1.7064901221793496e-05,2.2115312615509173,16,large,False,False,0.3875302201562961,PRUNED
941,941,1.0,2023-04-27 14:00:45.796789,2023-04-27 14:01:51.142025,0 days 00:01:05.345236,tanh,2.140147709597065e-05,0.999,0.995,2.136226263339707e-05,1.9229587204219283,32,large,True,False,0.3231469322686825,PRUNED
942,942,1.0,2023-04-27 14:01:51.144031,2023-04-27 14:02:49.606884,0 days 00:00:58.462853,tanh,0.016069918053668603,0.9,0.9,1.399706701125576e-05,1.4960087453432753,64,small,False,False,0.11053355574568702,PRUNED
943,943,1.0,2023-04-27 14:02:49.608885,2023-04-27 14:03:46.678019,0 days 00:00:57.069134,relu,2.45756055560889e-06,0.98,0.9999,1.14424422669337e-05,0.6519908226225014,128,large,True,False,0.26011251703359733,PRUNED
944,944,39.0,2023-04-27 14:03:46.680019,2023-04-27 14:04:44.524127,0 days 00:00:57.844108,tanh,0.0024710553272576214,0.999,0.9,3.0662457033573685e-05,0.808488229172946,512,large,False,False,0.1548593869411378,PRUNED
945,945,1.0,2023-04-27 14:04:44.526128,2023-04-27 14:05:42.024138,0 days 00:00:57.498010,tanh,5.781904759286129e-06,0.9999,0.98,1.9442424213915943e-05,0.32121243167237684,64,large,True,False,0.5051210226624616,PRUNED
946,946,1.0,2023-04-27 14:05:42.025138,2023-04-27 14:06:40.212846,0 days 00:00:58.187708,tanh,3.300073533932835e-05,0.95,0.99,1.5469479278380903e-05,0.3584940784961596,64,large,False,True,0.9388760315978606,PRUNED
947,947,1.0,2023-04-27 14:06:40.214842,2023-04-27 14:07:34.187238,0 days 00:00:53.972396,relu,1.5359228635859746e-05,0.999,0.9,2.452645892116766e-05,1.5717064255879853,128,small,True,False,0.2417919922816472,PRUNED
948,948,40.0,2023-04-27 14:07:34.189237,2023-04-27 14:08:37.181055,0 days 00:01:02.991818,tanh,0.0005043069551400986,0.9,0.9,0.000636149981112852,0.3346451479602505,64,large,True,False,0.2919957452615663,PRUNED
949,949,30.0,2023-04-27 14:08:37.183056,2023-04-27 14:09:33.301165,0 days 00:00:56.118109,tanh,0.00034483375610771903,0.95,0.9,0.003495340396552193,0.8734355742331861,512,large,False,False,0.12643732674752536,PRUNED
950,950,1.0,2023-04-27 14:09:33.302165,2023-04-27 14:10:29.022158,0 days 00:00:55.719993,tanh,0.0002456982840616368,0.99,0.98,0.00015211279903149438,0.5239497521758679,32,tiny,True,False,0.3556641688120198,PRUNED
951,951,47.0,2023-04-27 14:10:29.024179,2023-04-27 14:11:28.774469,0 days 00:00:59.750290,relu,0.003982737653873781,0.999,0.99,1.3454638584011687e-05,0.4422853982774998,128,large,False,False,0.16942799609794434,PRUNED
952,952,70.0,2023-04-27 14:11:28.775475,2023-04-27 14:12:51.791182,0 days 00:01:23.015707,tanh,4.513458728774822e-06,0.95,0.9,9.990422453939933e-05,0.619044681583179,64,small,True,False,0.10014900781373262,COMPLETE
953,953,78.0,2023-04-27 14:12:51.793697,2023-04-27 14:13:49.692239,0 days 00:00:57.898542,tanh,0.02196392886490646,0.999,0.999,1.1310686792523946e-05,1.2525594153202453,1024,large,False,False,0.41488471417536904,PRUNED
954,954,1.0,2023-04-27 14:13:49.694253,2023-04-27 14:14:51.306680,0 days 00:01:01.612427,tanh,3.0246882537842353e-06,0.98,0.9,1.7766402872475644e-05,0.3780021812842531,64,large,True,True,0.17894705970107114,PRUNED
955,955,1.0,2023-04-27 14:14:51.307679,2023-04-27 14:15:47.841235,0 days 00:00:56.533556,relu,0.05563338309159015,0.995,0.995,0.0005154968264592309,0.7461195728792018,128,large,False,False,0.11549373391173656,PRUNED
956,956,1.0,2023-04-27 14:15:47.842236,2023-04-27 14:16:40.437211,0 days 00:00:52.594975,tanh,0.00012485464519554085,0.9,0.9,1.5691459853321918e-05,1.1384153429928603,512,small,True,False,0.6382773144344698,PRUNED
957,957,69.0,2023-04-27 14:16:40.438215,2023-04-27 14:18:12.214320,0 days 00:01:31.776105,tanh,1.9235830218822782e-06,0.999,0.98,1.279509031754192e-05,1.0085199937051466,64,large,True,False,0.5335785665365883,COMPLETE
958,958,71.0,2023-04-27 14:18:12.216327,2023-04-27 14:19:42.292361,0 days 00:01:30.076034,relu,0.0001785410331821507,0.95,0.99,3.844672936816355e-05,0.4147366788527834,128,large,False,False,0.4437491773581484,COMPLETE
959,959,1.0,2023-04-27 14:19:42.295417,2023-04-27 14:20:42.953242,0 days 00:01:00.657825,tanh,0.012777056683504292,0.999,0.9999,1.1095704177626352e-05,0.9502080208358208,64,large,True,False,0.7794230932472274,PRUNED
960,960,1.0,2023-04-27 14:20:42.955481,2023-04-27 14:21:40.461168,0 days 00:00:57.505687,tanh,7.353540894793464e-06,0.9999,0.9,0.000407989366415514,4.978729503596061,32,small,False,False,0.26959302579927164,PRUNED
961,961,0.0,2023-04-27 14:21:40.462169,2023-04-27 14:22:44.612107,0 days 00:01:04.149938,tanh,2.4133848304440088e-05,0.95,0.9,1.970876524250517e-05,0.3413066388734832,64,large,True,False,0.13185690849503987,PRUNED
962,962,4.0,2023-04-27 14:22:44.615139,2023-04-27 14:23:43.817429,0 days 00:00:59.202290,relu,0.0012532531813760873,0.9,0.9,1.4616954149099923e-05,0.6900828571235084,512,large,False,True,0.36698442314780183,PRUNED
963,963,26.0,2023-04-27 14:23:43.820427,2023-04-27 14:24:45.559273,0 days 00:01:01.738846,tanh,1.1455011730165209e-05,0.999,0.98,0.003111023676086605,3.9851433847065274,128,tiny,True,False,0.8585789199598353,PRUNED
964,964,1.0,2023-04-27 14:24:45.561272,2023-04-27 14:26:01.208960,0 days 00:01:15.647688,tanh,0.008821239977493496,0.98,0.99,0.00025497979614110087,4.393190738248967,256,large,False,False,0.24908812383754617,PRUNED
965,965,70.0,2023-04-27 14:26:01.211997,2023-04-27 14:27:13.084120,0 days 00:01:11.872123,tanh,0.19776478045334397,0.95,0.9,4.246784461536552e-05,1.6036495804066326,64,large,True,False,0.14904368168770915,PRUNED
966,966,0.0,2023-04-27 14:27:13.085121,2023-04-27 14:28:17.361410,0 days 00:01:04.276289,relu,8.012984370718255e-05,0.999,0.9,1.2406513475520655e-05,0.5822448155708055,1024,small,True,False,0.21611994813382,PRUNED
967,967,1.0,2023-04-27 14:28:17.363368,2023-04-27 14:29:19.475391,0 days 00:01:02.112023,tanh,4.3550908262024626e-05,0.9,0.999,1.009199867842044e-05,0.36748902115291315,128,large,False,False,0.10391472710310586,PRUNED
968,968,1.0,2023-04-27 14:29:19.477389,2023-04-27 14:30:21.136101,0 days 00:01:01.658712,tanh,4.276245683820764e-06,0.999,0.9,2.821085275937509e-05,0.30006313114997185,16,large,True,False,0.12086458634729508,PRUNED
969,969,1.0,2023-04-27 14:30:21.138105,2023-04-27 14:31:17.935116,0 days 00:00:56.797011,tanh,0.00015034194996769095,0.95,0.98,0.0011439715237427602,0.8214912955157387,64,large,False,False,0.23254044990162606,PRUNED
970,970,1.0,2023-04-27 14:31:17.937117,2023-04-27 14:32:10.758814,0 days 00:00:52.821697,relu,2.3667296601079143e-06,0.995,0.99,1.706246780179234e-05,0.3990998291990324,512,small,True,True,0.11113804451577856,PRUNED
971,971,1.0,2023-04-27 14:32:10.760320,2023-04-27 14:33:08.856325,0 days 00:00:58.096005,tanh,3.1669691369060133e-06,0.999,0.995,0.0007352058143155311,0.3226073126564941,64,large,False,False,0.19200005202622275,PRUNED
972,972,1.0,2023-04-27 14:33:08.858326,2023-04-27 14:34:12.407537,0 days 00:01:03.549211,tanh,9.97353263005134e-05,0.95,0.9,0.005258463754196552,4.062775421463634,128,large,True,False,0.25994990363048975,PRUNED
973,973,1.0,2023-04-27 14:34:12.410051,2023-04-27 14:35:10.747151,0 days 00:00:58.337100,relu,0.11104147062377619,0.999,0.9999,1.3084241934309697e-05,0.35430688087417955,32,large,False,False,0.3097600827184817,PRUNED
974,974,1.0,2023-04-27 14:35:10.750658,2023-04-27 14:36:01.321263,0 days 00:00:50.570605,tanh,0.000742325480858822,0.98,0.9,0.0004623647128403988,0.6450592222464204,64,small,True,False,0.7267493916967834,PRUNED
975,975,50.0,2023-04-27 14:36:01.322309,2023-04-27 14:37:23.478066,0 days 00:01:22.155757,tanh,8.654546590418508e-06,0.9,0.98,0.00022156377927008038,2.88469916043875,128,large,True,False,0.3315173687264738,COMPLETE
976,976,1.0,2023-04-27 14:37:23.481098,2023-04-27 14:38:09.140949,0 days 00:00:45.659851,tanh,0.01387332295543782,0.9999,0.9,0.003978306635378535,0.5423491891403841,512,tiny,False,False,0.27753838272241776,PRUNED
977,977,1.0,2023-04-27 14:38:09.141955,2023-04-27 14:39:03.248911,0 days 00:00:54.106956,relu,1.7549365598039802e-05,0.999,0.99,0.000892862233695058,0.47946659363016236,64,large,True,False,0.6658735320541738,PRUNED
978,978,4.0,2023-04-27 14:39:03.248911,2023-04-27 14:39:57.986155,0 days 00:00:54.737244,tanh,0.00041335795013567705,0.95,0.9,6.798031103946161e-05,0.38616985109962276,64,large,False,True,0.13882287734526838,PRUNED
979,979,1.0,2023-04-27 14:39:57.988155,2023-04-27 14:40:50.361283,0 days 00:00:52.373128,tanh,5.6785398128131134e-06,0.99,0.9,0.00030967369305517174,1.0542065221856032,128,small,True,False,0.16167887648891383,PRUNED
980,980,1.0,2023-04-27 14:40:50.362291,2023-04-27 14:41:47.406090,0 days 00:00:57.043799,tanh,3.1093331301936143e-05,0.999,0.98,2.0624445099637226e-05,0.3275167312698119,64,large,False,False,0.8204539855990506,PRUNED
981,981,1.0,2023-04-27 14:41:47.408087,2023-04-27 14:42:42.178221,0 days 00:00:54.770134,relu,1.6802722467716135e-06,0.9,0.9,2.3808331712888958e-05,0.5075885211532687,512,large,True,False,0.47402936364699905,PRUNED
982,982,79.0,2023-04-27 14:42:42.179224,2023-04-27 14:43:41.898075,0 days 00:00:59.718851,tanh,1.0131966870001423e-06,0.95,0.999,0.0006088793174850809,0.44847657188982076,32,large,False,False,0.20136025594102264,PRUNED
983,983,1.0,2023-04-27 14:43:41.899073,2023-04-27 14:44:33.500942,0 days 00:00:51.601869,tanh,6.89364535204111e-06,0.999,0.99,1.0042102989003157e-05,0.6970882376809278,128,small,True,False,0.11622937821158298,PRUNED
984,984,1.0,2023-04-27 14:44:33.502945,2023-04-27 14:45:26.838502,0 days 00:00:53.335557,relu,0.0033007056572893372,0.98,0.9,1.538871052585364e-05,3.727029419476085,1024,large,True,False,0.10819207977259888,PRUNED
985,985,1.0,2023-04-27 14:45:26.840503,2023-04-27 14:46:22.077137,0 days 00:00:55.236634,tanh,0.0009047287897536679,0.95,0.9,1.777984946305815e-05,0.8778294383508547,64,large,False,False,0.5957123956042265,PRUNED
986,986,4.0,2023-04-27 14:46:22.080137,2023-04-27 14:47:18.347081,0 days 00:00:56.266944,tanh,0.00020255358961123542,0.999,0.995,4.467057477859491e-05,0.34837750998914613,64,large,True,True,0.8977403296662536,PRUNED
987,987,1.0,2023-04-27 14:47:18.349085,2023-04-27 14:48:05.637786,0 days 00:00:47.288701,tanh,0.060430670099248046,0.995,0.9999,0.0001039737788719167,0.597343439970024,128,tiny,False,False,0.3490450199417313,PRUNED
988,988,1.0,2023-04-27 14:48:05.639787,2023-04-27 14:48:59.247819,0 days 00:00:53.608032,relu,0.001514955545560231,0.9,0.98,1.1620044996506242e-05,1.1303239667584852,512,large,True,False,0.5492547980518864,PRUNED
989,989,1.0,2023-04-27 14:48:59.248822,2023-04-27 14:49:51.261817,0 days 00:00:52.012995,tanh,3.7840904379380397e-06,0.999,0.9,3.337365682467699e-05,0.3717510248348119,64,small,False,False,0.23203339461824654,PRUNED
990,990,25.0,2023-04-27 14:49:51.263819,2023-04-27 14:50:54.183591,0 days 00:01:02.919772,tanh,0.0002957815219195645,0.95,0.99,1.3645691802646555e-05,0.3154486729869479,128,large,True,False,0.9711159266097987,PRUNED
991,991,1.0,2023-04-27 14:50:54.185597,2023-04-27 14:51:55.259579,0 days 00:01:01.073982,tanh,0.09877662223643122,0.9999,0.9,1.612982835200453e-05,0.7600640154485047,64,large,False,False,0.12574199471062109,PRUNED
992,992,1.0,2023-04-27 14:51:55.260580,2023-04-27 14:52:56.477120,0 days 00:01:01.216540,relu,2.1194015101856662e-05,0.999,0.9,0.0012295419047202436,0.40737337685151137,32,large,True,False,0.29286636742505984,PRUNED
993,993,1.0,2023-04-27 14:52:56.479119,2023-04-27 14:53:52.246421,0 days 00:00:55.767302,tanh,4.8222157727124174e-05,0.95,0.98,0.002230589698054599,0.9574106857878985,256,small,False,False,0.17236822888446338,PRUNED
994,994,1.0,2023-04-27 14:53:52.247942,2023-04-27 14:54:50.143198,0 days 00:00:57.895256,tanh,0.005883731468766293,0.9,0.9,1.1391924308616392e-05,0.5498362816392935,512,large,True,True,0.2510234805475923,PRUNED
995,995,1.0,2023-04-27 14:54:50.144199,2023-04-27 14:55:49.560117,0 days 00:00:59.415918,tanh,1.0138975409856106e-05,0.999,0.99,0.0005564173245026289,0.3418534240148062,64,large,True,False,0.22427500003149292,PRUNED
996,996,1.0,2023-04-27 14:55:49.562116,2023-04-27 14:56:48.672892,0 days 00:00:59.110776,relu,0.000503298773993175,0.98,0.9,2.1942496966286934e-05,4.641668543889134,128,large,False,False,0.2087131800062862,PRUNED
997,997,35.0,2023-04-27 14:56:48.674891,2023-04-27 14:58:19.337789,0 days 00:01:30.662898,tanh,0.004333621487029224,0.95,0.9,0.0007832576399785479,0.6655374726629936,1024,small,True,False,0.10366121393219578,COMPLETE
998,998,1.0,2023-04-27 14:58:19.339788,2023-04-27 14:59:17.924952,0 days 00:00:58.585164,tanh,0.03480435940019867,0.999,0.999,6.716548843439503e-05,1.2965725446230645,64,large,False,False,0.9986509276051012,PRUNED
999,999,1.0,2023-04-27 14:59:17.925953,2023-04-27 15:00:16.384635,0 days 00:00:58.458682,relu,2.1781800967185537e-06,0.9,0.98,0.0001433060930647101,1.173154325681016,128,large,True,False,0.1142349714539663,PRUNED
