,number,value,datetime_start,datetime_complete,duration,params_activation_fn,params_ent_coef,params_gae_lambda,params_gamma,params_lr,params_max_grad_norm,params_n_steps,params_net_arch,params_normalize_advantage,params_ortho_init,params_vf_coef,state
703,703,58.0,2023-04-27 09:45:36.866877,2023-04-27 09:46:37.094065,0 days 00:01:00.227188,tanh,0.0006707315091368495,0.999,0.999,5.435965178167142e-05,0.8154156291184618,16,small,True,False,0.27739914396528065,PRUNED
704,704,1.0,2023-04-27 09:46:37.095068,2023-04-27 09:47:30.329487,0 days 00:00:53.234419,tanh,2.1248589033736223e-05,0.995,0.9,1.0047003546486036e-05,0.37885064660926804,64,large,False,False,0.21506579203728218,PRUNED
705,705,1.0,2023-04-27 09:47:30.331487,2023-04-27 09:48:23.501913,0 days 00:00:53.170426,tanh,6.627898209437546e-06,0.95,0.98,1.4403210615374752e-05,1.0198568139052737,32,large,True,False,0.10618960948662508,PRUNED
706,706,55.0,2023-04-27 09:48:23.502913,2023-04-27 09:49:15.397622,0 days 00:00:51.894709,relu,1.243754528274464e-06,0.999,0.9,1.6439866451937694e-05,0.45942715209362384,128,large,True,False,0.8502356764896922,PRUNED
707,707,48.0,2023-04-27 09:49:15.399626,2023-04-27 09:50:07.576822,0 days 00:00:52.177196,tanh,2.24037671717484e-06,0.98,0.9,2.909655456107314e-05,0.3568634494053221,512,small,False,False,0.26396329365225263,PRUNED
708,708,73.0,2023-04-27 09:50:07.577822,2023-04-27 09:51:02.185763,0 days 00:00:54.607941,tanh,0.00042417532302438605,0.999,0.99,1.250576490317774e-05,0.8766262583362205,64,large,True,False,0.134498603840582,PRUNED
709,709,1.0,2023-04-27 09:51:02.187763,2023-04-27 09:51:56.059612,0 days 00:00:53.871849,tanh,1.6457329126332718e-06,0.9,0.9,2.3911246105133843e-05,1.4113259932361804,64,large,True,False,0.5558775288904398,PRUNED
710,710,1.0,2023-04-27 09:51:56.061615,2023-04-27 09:52:44.854577,0 days 00:00:48.792962,tanh,0.00020059041255060658,0.9999,0.9,3.658423238562754e-05,0.49517248126421887,64,tiny,True,True,0.2374040725242335,PRUNED
711,711,1.0,2023-04-27 09:52:44.856577,2023-04-27 09:53:34.369235,0 days 00:00:49.512658,relu,8.70655305600625e-06,0.95,0.9,1.3884893060987113e-05,3.5187002340251974,128,small,False,False,0.28944741068482294,PRUNED
712,712,25.0,2023-04-27 09:53:34.371238,2023-04-27 09:54:32.078423,0 days 00:00:57.707185,tanh,5.274813602009894e-06,0.999,0.999,0.00010273843367263585,1.2610764828562522,64,large,True,False,0.11732237076920021,PRUNED
713,713,1.0,2023-04-27 09:54:32.080423,2023-04-27 09:55:23.711055,0 days 00:00:51.630632,tanh,0.00013119160979503772,0.999,0.9,1.1343866481665897e-05,3.83199747662894,512,large,True,False,0.6901204304073021,PRUNED
714,714,1.0,2023-04-27 09:55:23.713054,2023-04-27 09:56:18.191458,0 days 00:00:54.478404,tanh,1.0075097994296144e-06,0.95,0.98,1.8008062579277878e-05,0.3989343696411236,64,large,False,False,0.13127107155488194,PRUNED
715,715,1.0,2023-04-27 09:56:18.192457,2023-04-27 09:57:09.130390,0 days 00:00:50.937933,tanh,9.237949861192454e-05,0.99,0.995,0.0012578464187757933,0.5353064414418067,32,small,True,False,0.8076893457106957,PRUNED
716,716,46.0,2023-04-27 09:57:09.131387,2023-04-27 09:58:02.730226,0 days 00:00:53.598839,relu,3.269745726719531e-06,0.999,0.9,1.5722707106676726e-05,0.3294843758438693,64,large,True,False,0.252214641392364,PRUNED
717,717,1.0,2023-04-27 09:58:02.731225,2023-04-27 09:58:52.818137,0 days 00:00:50.086912,tanh,6.083269940377519e-05,0.9,0.99,2.1943245364489607e-05,1.0579047807387267,1024,large,False,False,0.30195635761638273,PRUNED
718,718,4.0,2023-04-27 09:58:52.820136,2023-04-27 09:59:50.745661,0 days 00:00:57.925525,tanh,4.264776084164844e-06,0.999,0.9,0.00041540684647498527,0.7369325589660257,64,large,True,True,0.14443955072845416,PRUNED
719,719,4.0,2023-04-27 09:59:50.747661,2023-04-27 10:00:50.642776,0 days 00:00:59.895115,tanh,1.565060077570023e-05,0.98,0.9,0.00012058162735665759,0.570042932992478,128,small,True,False,0.17998811285257876,PRUNED
720,720,1.0,2023-04-27 10:00:50.643777,2023-04-27 10:01:52.576449,0 days 00:01:01.932672,tanh,0.0005461386309176062,0.95,0.9,1.2422260612807912e-05,3.707002046999877,64,large,True,False,0.5013505612898819,PRUNED
721,721,1.0,2023-04-27 10:01:52.577968,2023-04-27 10:03:03.558134,0 days 00:01:10.980166,relu,0.05599302503333141,0.995,0.9,0.00020105861233030972,0.34813531273030573,512,large,False,False,0.42613060251963314,PRUNED
722,722,1.0,2023-04-27 10:03:03.560146,2023-04-27 10:04:12.578507,0 days 00:01:09.018361,tanh,0.0011312850823695095,0.999,0.9999,0.0002912551108339437,0.31319755324540766,64,small,True,False,0.11097052340731195,PRUNED
723,723,1.0,2023-04-27 10:04:12.580514,2023-04-27 10:05:19.165588,0 days 00:01:06.585074,tanh,0.0009082588264405396,0.95,0.999,1.1140734745309636e-05,0.3724852861661949,64,tiny,True,False,0.2044020057612077,PRUNED
724,724,87.0,2023-04-27 10:05:19.169147,2023-04-27 10:07:11.582267,0 days 00:01:52.413120,tanh,3.171568801499465e-05,0.999,0.99,0.000585180871532515,0.6815467835401102,128,large,False,False,0.15216667483677712,COMPLETE
725,725,1.0,2023-04-27 10:07:11.585266,2023-04-27 10:08:27.698420,0 days 00:01:16.113154,tanh,3.222807090745578e-05,0.9,0.99,2.638795709939932e-05,0.6222864519406861,128,large,False,False,0.12242743051773378,PRUNED
726,726,1.0,2023-04-27 10:08:27.700349,2023-04-27 10:09:40.514905,0 days 00:01:12.814556,relu,1.220066085568476e-05,0.9999,0.99,0.0014090283025499745,0.6872399634006561,128,large,False,True,0.16823036987495224,PRUNED
727,727,7.0,2023-04-27 10:09:40.515902,2023-04-27 10:11:09.623224,0 days 00:01:29.107322,tanh,2.4196577096970102e-05,0.999,0.99,0.0006415841786857844,3.23422783916487,128,large,False,False,0.14907618644509985,PRUNED
728,728,25.0,2023-04-27 10:11:09.626736,2023-04-27 10:12:37.517380,0 days 00:01:27.890644,tanh,1.892433435414521e-06,0.95,0.99,0.004422792042938774,0.771260772915476,128,large,False,False,0.13802826111509922,PRUNED
729,729,1.0,2023-04-27 10:12:37.519465,2023-04-27 10:13:50.345381,0 days 00:01:12.825916,tanh,2.6303708086239226e-06,0.999,0.99,0.0004903603886351073,0.6983880257143863,128,large,False,False,0.12941014507446302,PRUNED
730,730,1.0,2023-04-27 10:13:50.348434,2023-04-27 10:15:02.540175,0 days 00:01:12.191741,tanh,1.8291147657556183e-05,0.98,0.99,0.0007004372480451612,0.6672269200995846,128,large,False,False,0.22672125782176064,PRUNED
731,731,0.0,2023-04-27 10:15:02.542172,2023-04-27 10:16:21.055510,0 days 00:01:18.513338,relu,0.1942113721233587,0.999,0.99,6.422941378049835e-05,0.6603735137264145,128,large,False,False,0.6001269475281605,PRUNED
732,732,26.0,2023-04-27 10:16:21.057509,2023-04-27 10:17:36.710610,0 days 00:01:15.653101,tanh,0.0021529707973957403,0.95,0.99,0.0005989151260225724,1.6222646544360482,128,large,False,False,0.15570227665370218,PRUNED
733,733,1.0,2023-04-27 10:17:36.712609,2023-04-27 10:18:51.979274,0 days 00:01:15.266665,tanh,0.004159366163968955,0.9,0.99,0.0004588793930059143,0.7882389977394129,128,large,False,False,0.10399197662004182,PRUNED
734,734,4.0,2023-04-27 10:18:51.981273,2023-04-27 10:20:06.364288,0 days 00:01:14.383015,tanh,6.535246179507825e-06,0.999,0.99,0.0005260313441846509,0.7132692650567326,128,large,False,True,0.11978316795443081,PRUNED
735,735,46.0,2023-04-27 10:20:06.366286,2023-04-27 10:21:25.445366,0 days 00:01:19.079080,tanh,0.00037038268873816095,0.999,0.99,0.0003930385850005065,0.6192006909362263,128,large,False,False,0.2690994288875379,PRUNED
736,736,54.0,2023-04-27 10:21:25.447374,2023-04-27 10:22:50.794513,0 days 00:01:25.347139,relu,3.575615009044927e-06,0.995,0.99,5.7203985120865e-05,0.41791226687700944,32,large,False,False,0.19687653801212238,PRUNED
737,737,1.0,2023-04-27 10:22:50.797514,2023-04-27 10:24:06.044431,0 days 00:01:15.246917,tanh,9.329427899777062e-06,0.95,0.98,0.0009524377603159098,0.33138609174778383,128,large,False,False,0.2414640679713972,PRUNED
738,738,1.0,2023-04-27 10:24:06.046426,2023-04-27 10:25:20.674319,0 days 00:01:14.627893,tanh,0.003593892485504869,0.999,0.99,0.0005560099499286517,3.0488108671893555,512,large,False,False,0.4434440369989398,PRUNED
739,739,1.0,2023-04-27 10:25:20.676322,2023-04-27 10:26:37.815571,0 days 00:01:17.139249,tanh,3.1549619961580776e-05,0.98,0.995,4.0808567458914696e-05,0.5132074919287227,256,large,False,False,0.327001908923504,PRUNED
740,740,1.0,2023-04-27 10:26:37.818370,2023-04-27 10:27:54.109264,0 days 00:01:16.290894,tanh,0.00026437700788827087,0.9999,0.999,7.288175632580972e-05,0.5901637151876732,128,large,False,False,0.255550323829443,PRUNED
741,741,1.0,2023-04-27 10:27:54.111261,2023-04-27 10:29:11.881505,0 days 00:01:17.770244,tanh,0.09387826231726648,0.999,0.98,1.9433861768118703e-05,0.3837788418460354,16,large,False,False,0.12662364831354286,PRUNED
742,742,1.0,2023-04-27 10:29:11.883508,2023-04-27 10:30:21.021255,0 days 00:01:09.137747,relu,1.281569726765184e-06,0.9,0.99,0.00025818302424044184,0.7325374671998369,1024,large,False,True,0.11308054729475815,PRUNED
743,743,1.0,2023-04-27 10:30:21.025258,2023-04-27 10:31:38.451408,0 days 00:01:17.426150,tanh,0.005333779240837233,0.95,0.99,0.0007258883310645924,2.419517694973414,32,large,False,False,0.21116532761759493,PRUNED
744,744,38.0,2023-04-27 10:31:38.453406,2023-04-27 10:33:01.415607,0 days 00:01:22.962201,tanh,5.204632834378609e-06,0.999,0.999,2.086703149582469e-05,0.35523341531898894,128,large,False,False,0.22600637493828876,PRUNED
745,745,44.0,2023-04-27 10:33:01.420202,2023-04-27 10:34:16.716267,0 days 00:01:15.296065,tanh,1.320702425155623e-05,0.999,0.98,0.0011444784903332874,0.5428081438706608,512,large,True,False,0.1418092248035162,PRUNED
746,746,74.0,2023-04-27 10:34:16.719360,2023-04-27 10:35:25.963405,0 days 00:01:09.244045,tanh,7.72436115402852e-06,0.95,0.995,0.000815841747101379,0.31472343092270333,128,tiny,False,False,0.7313641926644192,PRUNED
747,747,1.0,2023-04-27 10:35:25.965409,2023-04-27 10:36:40.034127,0 days 00:01:14.068718,relu,0.012637513844256553,0.999,0.9,1.5304336412777373e-05,0.4824065586844435,512,large,True,False,0.63021075994569,PRUNED
748,748,1.0,2023-04-27 10:36:40.035129,2023-04-27 10:37:59.726226,0 days 00:01:19.691097,tanh,2.1285826177224515e-06,0.99,0.9,0.00014160080108785347,0.6377891709021649,32,large,True,False,0.10725349775780282,PRUNED
749,749,4.0,2023-04-27 10:37:59.727736,2023-04-27 10:39:18.243628,0 days 00:01:18.515892,tanh,2.7089729226184514e-06,0.9,0.99,0.008648993509786915,0.30026110826249347,128,large,False,False,0.2805359567655675,PRUNED
750,750,4.0,2023-04-27 10:39:18.245153,2023-04-27 10:40:34.047373,0 days 00:01:15.802220,tanh,0.0001541634850649794,0.98,0.9,1.7577809617148355e-05,0.3430997749682097,1024,large,True,True,0.15135547651607809,PRUNED
751,751,55.0,2023-04-27 10:40:34.050155,2023-04-27 10:41:50.421884,0 days 00:01:16.371729,tanh,1.5963669765064346e-06,0.999,0.9,0.00013091555358057087,0.435707738600577,64,large,True,False,0.4054249621066161,PRUNED
752,752,85.0,2023-04-27 10:41:50.422884,2023-04-27 10:43:17.648445,0 days 00:01:27.225561,relu,2.748568585560702e-05,0.95,0.9999,3.396224891503831e-05,0.3967978704582085,512,large,False,False,0.5210061994147731,COMPLETE
753,753,22.0,2023-04-27 10:43:17.650451,2023-04-27 10:44:35.773437,0 days 00:01:18.122986,relu,0.12302677401475996,0.95,0.9999,2.6216605187030895e-05,0.3988705161834082,512,large,False,False,0.359978987015563,PRUNED
754,754,68.0,2023-04-27 10:44:35.775448,2023-04-27 10:46:05.221057,0 days 00:01:29.445609,relu,3.137303913054499e-05,0.95,0.9999,4.8957220012676133e-05,0.3847683564060256,512,large,False,False,0.5062955832347832,PRUNED
755,755,0.0,2023-04-27 10:46:05.223059,2023-04-27 10:47:44.620596,0 days 00:01:39.397537,relu,2.0521424644240106e-05,0.95,0.9999,2.1878264684135808e-05,0.41754845597564927,512,large,False,False,0.6312809136677168,PRUNED
756,756,1.0,2023-04-27 10:47:44.624590,2023-04-27 10:49:19.370564,0 days 00:01:34.745974,relu,0.0164798691646465,0.95,0.999,2.4075518345616693e-05,0.3636067097569121,512,large,False,False,0.4791236865112417,PRUNED
757,757,1.0,2023-04-27 10:49:19.372092,2023-04-27 10:50:49.035264,0 days 00:01:29.663172,relu,2.4552311701307683e-05,0.95,0.9999,2.9642481132347e-05,0.458157548496403,512,large,False,False,0.11411602878216841,PRUNED
758,758,1.0,2023-04-27 10:50:49.038284,2023-04-27 10:52:11.350035,0 days 00:01:22.311751,relu,2.5489542288251504e-05,0.95,0.9999,0.006359121887043361,2.5395233039251437,512,tiny,False,False,0.11906772521132267,PRUNED
759,759,1.0,2023-04-27 10:52:11.352558,2023-04-27 10:53:41.859228,0 days 00:01:30.506670,relu,4.4735288587054005e-05,0.95,0.98,0.0006137933023444892,0.3921043909259894,512,large,False,True,0.5736925380611468,PRUNED
760,760,1.0,2023-04-27 10:53:41.863231,2023-04-27 10:55:08.946519,0 days 00:01:27.083288,relu,1.7153821223854093e-05,0.95,0.9999,3.984436720095088e-05,0.36658661906553663,512,large,False,False,0.3192520581579915,PRUNED
761,761,1.0,2023-04-27 10:55:08.949517,2023-04-27 10:56:36.684333,0 days 00:01:27.734816,relu,3.397301908884309e-05,0.95,0.9999,3.042131956207545e-05,0.8104675162713908,512,large,False,False,0.108470875837123,PRUNED
762,762,0.0,2023-04-27 10:56:36.687375,2023-04-27 10:58:13.350239,0 days 00:01:36.662864,relu,0.006241895433539144,0.95,0.9999,1.0040149775322806e-05,0.41736904465042457,512,large,False,False,0.5447165104922554,PRUNED
763,763,0.0,2023-04-27 10:58:13.353239,2023-04-27 10:59:49.348335,0 days 00:01:35.995096,relu,0.07057670831160734,0.95,0.9999,1.957690061772449e-05,0.3362106129331384,512,large,False,False,0.3771662791043996,PRUNED
764,764,40.0,2023-04-27 10:59:49.350949,2023-04-27 11:01:22.373280,0 days 00:01:33.022331,relu,3.7898450873061314e-05,0.95,0.9999,0.0054970343789722065,0.7582759197240084,512,large,False,False,0.6513900897213913,PRUNED
765,765,60.0,2023-04-27 11:01:22.377325,2023-04-27 11:03:42.820357,0 days 00:02:20.443032,relu,1.2950305966100601e-05,0.995,0.9999,2.2805298122308228e-05,0.6831336680914311,128,large,False,False,0.5309889281402966,COMPLETE
766,766,1.0,2023-04-27 11:03:42.824360,2023-04-27 11:05:03.987059,0 days 00:01:21.162699,relu,2.068266830976542e-05,0.95,0.9999,8.597453365680686e-05,0.5919227151318408,32,tiny,False,False,0.7463862613814454,PRUNED
767,767,1.0,2023-04-27 11:05:03.990537,2023-04-27 11:06:29.894777,0 days 00:01:25.904240,relu,9.484278904441337e-06,0.9999,0.99,0.00016091983129161615,0.3257339270211855,256,large,False,True,0.40317727061136194,PRUNED
768,768,0.0,2023-04-27 11:06:29.896880,2023-04-27 11:08:07.107207,0 days 00:01:37.210327,relu,1.38946664770509e-06,0.9,0.995,1.669520116692867e-05,0.37701321252458,512,large,False,False,0.5654705891986336,PRUNED
769,769,1.0,2023-04-27 11:08:07.110208,2023-04-27 11:09:35.256439,0 days 00:01:28.146231,relu,0.00029642438410860017,0.95,0.9999,2.654332325686681e-05,1.735029124419268,128,large,False,False,0.6945812610427825,PRUNED
770,770,1.0,2023-04-27 11:09:35.260438,2023-04-27 11:11:12.047288,0 days 00:01:36.786850,relu,0.022222917221969528,0.98,0.99,0.0003449094101500219,2.846659755931743,16,large,False,False,0.4696788530359473,PRUNED
771,771,1.0,2023-04-27 11:11:12.050279,2023-04-27 11:12:51.729304,0 days 00:01:39.679025,tanh,0.0002014646553132124,0.95,0.999,1.0000465838583998e-05,0.844897291421696,1024,large,False,False,0.1040162253759688,PRUNED
772,772,84.0,2023-04-27 11:12:51.732306,2023-04-27 11:15:08.029516,0 days 00:02:16.297210,tanh,0.19875841799690566,0.9,0.98,1.900627109229234e-05,0.35480310886592015,128,large,False,False,0.7379248603154164,COMPLETE
773,773,1.0,2023-04-27 11:15:08.034515,2023-04-27 11:16:24.517607,0 days 00:01:16.483092,tanh,0.000329399108365366,0.9,0.98,1.435958367292543e-05,0.34759279533047516,128,large,False,False,0.8724609532205013,PRUNED
774,774,34.0,2023-04-27 11:16:24.519608,2023-04-27 11:17:28.112266,0 days 00:01:03.592658,relu,0.03248901677912899,0.995,0.98,1.7279188626214974e-05,0.31293052994849796,128,large,False,False,0.12418161529424028,PRUNED
775,775,0.0,2023-04-27 11:17:28.113265,2023-04-27 11:18:34.311886,0 days 00:01:06.198621,tanh,0.00012383147752337596,0.95,0.98,3.2337675845217355e-05,3.537020484690238,128,large,False,False,0.8446559082902366,PRUNED
776,776,1.0,2023-04-27 11:18:34.314404,2023-04-27 11:19:50.123345,0 days 00:01:15.808941,tanh,0.06065942093346005,0.95,0.98,1.9301842999072146e-05,0.348321259204527,128,large,False,True,0.675488329839667,PRUNED
777,777,53.0,2023-04-27 11:19:50.126364,2023-04-27 11:20:59.539242,0 days 00:01:09.412878,tanh,8.488029845716582e-05,0.9999,0.98,8.369758825539361e-05,0.56449943704744,128,tiny,False,False,0.7106411513550701,PRUNED
778,778,0.0,2023-04-27 11:20:59.542116,2023-04-27 11:22:20.457512,0 days 00:01:20.915396,tanh,0.0063339707417195594,0.98,0.98,0.002354861995468628,0.335946448439833,128,large,False,False,0.825257701572909,PRUNED
779,779,131.0,2023-04-27 11:22:20.459514,2023-04-27 11:24:12.463137,0 days 00:01:52.003623,relu,0.003977823372870075,0.9,0.98,0.0008424034312417432,0.36364187553855004,128,large,False,False,0.7944100292673941,COMPLETE
780,780,0.0,2023-04-27 11:24:12.466163,2023-04-27 11:25:31.530023,0 days 00:01:19.063860,relu,0.0025052782261195563,0.9,0.98,0.001433612013913969,0.3601232570510297,128,large,False,False,0.6841479063176729,PRUNED
781,781,1.0,2023-04-27 11:25:31.532026,2023-04-27 11:26:42.615269,0 days 00:01:11.083243,relu,0.10683015294798515,0.9,0.98,0.0008771481255353648,0.9099537939131593,128,large,False,False,0.8006732837406255,PRUNED
782,782,1.0,2023-04-27 11:26:42.617775,2023-04-27 11:27:55.154074,0 days 00:01:12.536299,relu,0.0003386213438774539,0.9,0.98,0.0006722766877348527,0.6404086697226768,128,large,False,False,0.7511595423192925,PRUNED
783,783,72.0,2023-04-27 11:27:55.157536,2023-04-27 11:29:10.646185,0 days 00:01:15.488649,relu,0.0012412693292873508,0.9,0.98,0.0002808820148246026,1.8386998855258827,128,large,False,False,0.29235936898459963,PRUNED
784,784,1.0,2023-04-27 11:29:10.647194,2023-04-27 11:30:21.808470,0 days 00:01:11.161276,relu,0.17547989987872872,0.9,0.98,0.0005659605555761742,0.37569048691102125,128,large,False,False,0.7111319250983458,PRUNED
785,785,1.0,2023-04-27 11:30:21.813466,2023-04-27 11:31:37.193129,0 days 00:01:15.379663,relu,0.08067376434117635,0.9,0.98,0.0009377188571891451,0.5130026502644105,128,large,False,True,0.9134475620692797,PRUNED
786,786,1.0,2023-04-27 11:31:37.195629,2023-04-27 11:32:56.959061,0 days 00:01:19.763432,relu,0.012504190075591294,0.9,0.98,0.0017826970748397147,0.39839859189193194,128,large,False,False,0.2693262348473139,PRUNED
787,787,36.0,2023-04-27 11:32:56.960064,2023-04-27 11:34:14.112597,0 days 00:01:17.152533,relu,0.004567692613118356,0.9,0.98,0.0012880676089396296,0.7339479155837448,128,small,False,False,0.132205932960649,PRUNED
788,788,1.0,2023-04-27 11:34:14.116110,2023-04-27 11:35:27.386501,0 days 00:01:13.270391,relu,2.8128558076947938e-05,0.9,0.98,0.0004805464284525789,0.369478953382618,128,tiny,False,False,0.8645536707269791,PRUNED
789,789,1.0,2023-04-27 11:35:27.388511,2023-04-27 11:36:43.500487,0 days 00:01:16.111976,relu,0.0022230565911717437,0.9,0.98,0.0007747405829860465,0.4811047672988789,128,large,False,False,0.7809046599760995,PRUNED
790,790,2.0,2023-04-27 11:36:43.502490,2023-04-27 11:38:05.832192,0 days 00:01:22.329702,relu,0.027384213824769885,0.9,0.98,0.0016362838491857826,0.6186158507458824,128,large,False,False,0.7687331836893833,PRUNED
791,791,1.0,2023-04-27 11:38:05.834189,2023-04-27 11:39:17.971650,0 days 00:01:12.137461,relu,0.020413017361832778,0.9,0.98,0.0007626404798953033,0.44316976441524,128,large,False,False,0.8366289645594109,PRUNED
792,792,1.0,2023-04-27 11:39:17.973650,2023-04-27 11:40:14.005232,0 days 00:00:56.031582,relu,0.041372230100510825,0.95,0.98,0.000980997550491984,0.5659878113218425,128,small,False,False,0.8645487554537811,PRUNED
793,793,0.0,2023-04-27 11:40:14.007232,2023-04-27 11:41:16.469589,0 days 00:01:02.462357,relu,0.003297825955285974,0.99,0.98,0.0004040542491132334,2.062559036913511,128,large,False,True,0.11611442332106751,PRUNED
794,794,1.0,2023-04-27 11:41:16.472588,2023-04-27 11:42:11.060694,0 days 00:00:54.588106,relu,0.014044862907898364,0.9,0.98,0.00021805989702922246,0.8736221180701099,128,large,False,False,0.743406465507853,PRUNED
795,795,75.0,2023-04-27 11:42:11.063694,2023-04-27 11:43:06.959862,0 days 00:00:55.896168,relu,0.0030432914399371124,0.95,0.98,0.0011018371072093823,2.5168342828779533,128,large,False,False,0.8037433143313413,PRUNED
796,796,1.0,2023-04-27 11:43:06.960863,2023-04-27 11:44:04.174941,0 days 00:00:57.214078,relu,0.00019074281917866618,0.95,0.98,0.0007194709895545996,0.6941311394363925,128,small,False,False,0.9150641220622994,PRUNED
797,797,50.0,2023-04-27 11:44:04.176942,2023-04-27 11:44:59.702248,0 days 00:00:55.525306,relu,0.011368052661802493,0.98,0.98,0.0011826516730271761,0.3515483295419066,512,large,False,False,0.6429669899798915,PRUNED
798,798,31.0,2023-04-27 11:44:59.704247,2023-04-27 11:45:57.495557,0 days 00:00:57.791310,relu,0.004147189300737231,0.995,0.99,0.0010962341690967487,0.7997235811883203,128,large,False,False,0.9290840610469052,PRUNED
799,799,1.0,2023-04-27 11:45:57.497555,2023-04-27 11:46:51.694438,0 days 00:00:54.196883,tanh,0.09762945864579073,0.9,0.98,3.5941242528546976e-05,0.32668380450695883,32,large,False,False,0.12941998735189267,PRUNED
800,800,1.0,2023-04-27 11:46:51.696436,2023-04-27 11:47:41.687645,0 days 00:00:49.991209,relu,0.05267534431389565,0.95,0.99,0.0005976011601302679,0.4037148638186282,128,small,False,False,0.7252573137524397,PRUNED
801,801,1.0,2023-04-27 11:47:41.689649,2023-04-27 11:48:27.434177,0 days 00:00:45.744528,tanh,0.0012831241398492189,0.9,0.995,0.00037151012873977326,2.2794138471643377,512,tiny,False,True,0.12249142454078345,PRUNED
802,802,35.0,2023-04-27 11:48:27.436176,2023-04-27 11:49:18.990275,0 days 00:00:51.554099,tanh,0.009336546890658142,0.9999,0.9999,0.0008082266261197906,0.3150083852775822,128,large,False,False,0.5864774219597555,PRUNED
