,number,value,datetime_start,datetime_complete,duration,params_activation_fn,params_ent_coef,params_gae_lambda,params_gamma,params_lr,params_max_grad_norm,params_n_steps,params_net_arch,params_normalize_advantage,params_ortho_init,params_vf_coef,state
803,803,40.0,2023-04-27 11:49:18.992276,2023-04-27 11:50:17.521299,0 days 00:00:58.529023,tanh,0.017147010733747317,0.95,0.98,0.0018607745654007869,4.01681067147346,1024,large,False,False,0.4391342788799972,PRUNED
804,804,1.0,2023-04-27 11:50:17.523299,2023-04-27 11:51:09.246689,0 days 00:00:51.723390,relu,0.0016720713049815975,0.95,0.99,0.0001794388825180122,0.3002679664500112,512,large,False,False,0.9548435694025171,PRUNED
805,805,1.0,2023-04-27 11:51:09.248691,2023-04-27 11:52:01.472303,0 days 00:00:52.223612,tanh,0.1374053744870998,0.98,0.98,0.004920304954452598,0.38361282625092724,32,small,False,False,0.768785299549315,PRUNED
806,806,68.0,2023-04-27 11:52:01.473303,2023-04-27 11:52:55.809710,0 days 00:00:54.336407,tanh,0.0001762582368703497,0.9,0.99,3.5195627943117396e-05,0.5407663676776308,128,large,False,False,0.8133433829690938,PRUNED
807,807,1.0,2023-04-27 11:52:55.811708,2023-04-27 11:53:48.758283,0 days 00:00:52.946575,tanh,0.16622664041989804,0.995,0.995,2.1392024111145793e-05,0.939353668706314,128,large,False,False,0.4607673412958819,PRUNED
808,808,53.0,2023-04-27 11:53:48.759281,2023-04-27 11:54:39.887969,0 days 00:00:51.128688,relu,0.0006043950019229789,0.95,0.98,0.0005044970511325705,0.3597226216730487,512,large,False,False,0.3113738769546274,PRUNED
809,809,4.0,2023-04-27 11:54:39.888965,2023-04-27 11:55:27.909965,0 days 00:00:48.021000,tanh,0.19907849332906186,0.9999,0.9999,1.1844965160234151e-05,4.42436444493003,256,small,False,True,0.25964635537329195,PRUNED
810,810,1.0,2023-04-27 11:55:27.910963,2023-04-27 11:56:18.974920,0 days 00:00:51.063957,tanh,0.015058387843885426,0.99,0.99,1.4562007943657002e-05,4.98507771483221,128,large,False,False,0.3464283951807925,PRUNED
811,811,1.0,2023-04-27 11:56:18.975916,2023-04-27 11:57:12.220614,0 days 00:00:53.244698,tanh,0.036713232954464325,0.95,0.98,0.0015028900933739308,0.5991280401333328,32,large,False,False,0.13921019411001775,PRUNED
812,812,1.0,2023-04-27 11:57:12.222613,2023-04-27 11:58:08.133947,0 days 00:00:55.911334,relu,0.14826120615140093,0.98,0.99,6.392261665295361e-05,0.5175779738512396,16,large,False,False,0.2453807913701461,PRUNED
813,813,53.0,2023-04-27 11:58:08.135946,2023-04-27 11:58:52.671761,0 days 00:00:44.535815,tanh,0.002404481652007372,0.9,0.9,4.3581072345751977e-05,0.6544942696010027,512,tiny,False,False,0.8825310696946329,PRUNED
814,814,1.0,2023-04-27 11:58:52.673760,2023-04-27 11:59:40.365254,0 days 00:00:47.691494,tanh,0.010812770066115411,0.95,0.9,0.004783932902319083,2.2409865710680976,128,small,False,False,0.1614476126512669,PRUNED
815,815,1.0,2023-04-27 11:59:40.366257,2023-04-27 12:00:30.383288,0 days 00:00:50.017031,tanh,0.04117416986675106,0.9,0.98,0.0008524591844305191,0.7588181479714465,1024,large,False,False,0.11005066380616058,PRUNED
816,816,1.0,2023-04-27 12:00:30.385288,2023-04-27 12:01:24.648615,0 days 00:00:54.263327,relu,0.03802991521034248,0.95,0.995,2.482259684451281e-05,0.46247381612450966,128,large,False,False,0.7725973458077374,PRUNED
817,817,26.0,2023-04-27 12:01:24.649618,2023-04-27 12:02:20.855149,0 days 00:00:56.205531,tanh,0.00011300642126206101,0.995,0.9,0.00065649747321049,0.3341089983828544,512,large,False,True,0.234387765065933,PRUNED
818,818,52.0,2023-04-27 12:02:20.856147,2023-04-27 12:03:42.624377,0 days 00:01:21.768230,tanh,0.0026263566718772403,0.95,0.99,9.560803195528351e-05,0.4150316147239512,32,large,False,False,0.1001565760960705,COMPLETE
819,819,73.0,2023-04-27 12:03:42.627381,2023-04-27 12:04:33.782780,0 days 00:00:51.155399,tanh,0.021950968005898325,0.98,0.9999,0.002706335360100166,0.719988775310849,128,small,False,False,0.38964062204015737,PRUNED
820,820,1.0,2023-04-27 12:04:33.784780,2023-04-27 12:05:24.628841,0 days 00:00:50.844061,relu,0.004680677562987968,0.9,0.9,1.8424052732772452e-05,0.37295103149269615,128,large,False,False,0.2800121698858484,PRUNED
821,821,1.0,2023-04-27 12:05:24.629847,2023-04-27 12:06:14.312657,0 days 00:00:49.682810,tanh,0.006491881465168663,0.999,0.9,0.009678664776110959,0.345829012947109,512,large,False,False,0.11809622879816283,PRUNED
822,822,72.0,2023-04-27 12:06:14.314656,2023-04-27 12:07:06.137139,0 days 00:00:51.822483,tanh,0.04403585294559076,0.9999,0.98,0.00015235529506351175,0.8451379610262512,1024,large,False,False,0.14543598376644737,PRUNED
823,823,1.0,2023-04-27 12:07:06.139139,2023-04-27 12:07:54.177245,0 days 00:00:48.038106,tanh,0.030068084643653382,0.95,0.9,0.00013417158873022564,0.3195361760639153,128,small,False,False,0.13291627886242446,PRUNED
824,824,1.0,2023-04-27 12:07:54.179247,2023-04-27 12:08:46.508588,0 days 00:00:52.329341,relu,0.0007250008157392375,0.999,0.99,1.1375047088858028e-05,0.6448394360860068,32,large,True,False,0.3010590201709336,PRUNED
825,825,8.0,2023-04-27 12:08:46.510592,2023-04-27 12:09:36.152280,0 days 00:00:49.641688,tanh,0.027268502798933135,0.999,0.9,1.6113419398024095e-05,1.4657275634573563,512,large,False,True,0.6648089629919072,PRUNED
826,826,0.0,2023-04-27 12:09:36.153278,2023-04-27 12:10:43.281727,0 days 00:01:07.128449,tanh,0.1630100603146586,0.9,0.9,0.0003518463631824804,2.6027879845091135,128,tiny,True,False,0.7284588020099466,PRUNED
827,827,0.0,2023-04-27 12:10:43.283727,2023-04-27 12:11:45.472502,0 days 00:01:02.188775,tanh,0.0008273172887423675,0.98,0.98,1.3255312014004287e-05,0.3873648109982309,256,large,False,False,0.12531923392248784,PRUNED
828,828,1.0,2023-04-27 12:11:45.473368,2023-04-27 12:12:33.055028,0 days 00:00:47.581660,relu,0.01601201664076093,0.95,0.9,0.00029488152312312813,0.4885051782434266,128,small,True,False,0.6068560298875632,PRUNED
829,829,1.0,2023-04-27 12:12:33.056026,2023-04-27 12:13:26.657139,0 days 00:00:53.601113,tanh,0.0002689643792120644,0.999,0.99,2.8844503690507662e-05,0.43212749277037904,512,large,True,False,0.373925825608242,PRUNED
830,830,4.0,2023-04-27 12:13:26.659136,2023-04-27 12:14:39.317573,0 days 00:01:12.658437,tanh,0.1335761255024618,0.95,0.995,1.0032768552761944e-05,0.5869369099986613,16,large,False,False,0.11218800447942455,PRUNED
831,831,0.0,2023-04-27 12:14:39.320570,2023-04-27 12:15:42.684689,0 days 00:01:03.364119,relu,0.07995040406964782,0.995,0.9,2.187337012772945e-05,0.906873256097734,32,large,True,False,0.17974197549743356,PRUNED
832,832,1.0,2023-04-27 12:15:42.686688,2023-04-27 12:16:30.221672,0 days 00:00:47.534984,tanh,0.09036998137188632,0.999,0.9999,5.195207460396241e-05,1.3082720589564452,128,small,False,False,0.26315921567013506,PRUNED
833,833,6.0,2023-04-27 12:16:30.223671,2023-04-27 12:17:22.669424,0 days 00:00:52.445753,tanh,0.05466171458547197,0.9,0.9,0.00042580813759918624,0.5592683440424023,512,large,True,True,0.8947741319843672,PRUNED
834,834,66.0,2023-04-27 12:17:22.670427,2023-04-27 12:18:29.875069,0 days 00:01:07.204642,tanh,0.12996921834742295,0.99,0.98,0.002220728249079074,0.35158217960318766,1024,large,False,False,0.245900148305917,PRUNED
835,835,1.0,2023-04-27 12:18:29.876066,2023-04-27 12:19:20.958340,0 days 00:00:51.082274,relu,0.013424748544485741,0.999,0.9,0.00024235455058595534,0.6918205123018283,128,large,True,False,0.33868431514886,PRUNED
836,836,34.0,2023-04-27 12:19:20.960343,2023-04-27 12:20:17.185125,0 days 00:00:56.224782,tanh,0.032491218350956495,0.95,0.99,1.5559520567314283e-05,0.9795611528419156,128,large,True,False,0.9408577131743469,PRUNED
837,837,1.0,2023-04-27 12:20:17.187128,2023-04-27 12:21:09.875275,0 days 00:00:52.688147,tanh,0.0009668680119993405,0.9999,0.9,0.001552689541712035,1.9422936639440405,512,tiny,False,False,0.19106299215327893,PRUNED
838,838,1.0,2023-04-27 12:21:09.878271,2023-04-27 12:22:03.376574,0 days 00:00:53.498303,tanh,9.27022522926397e-05,0.98,0.9,1.923250745574868e-05,0.8051380478497837,32,small,True,False,0.5212609496116775,PRUNED
839,839,1.0,2023-04-27 12:22:03.377575,2023-04-27 12:22:57.378278,0 days 00:00:54.000703,relu,0.006444050342085162,0.999,0.98,0.00010018792964680434,0.3279821450732408,128,large,False,False,0.7909550668312451,PRUNED
840,840,1.0,2023-04-27 12:22:57.381803,2023-04-27 12:23:53.799228,0 days 00:00:56.417425,tanh,0.0016251824810141222,0.95,0.9,1.3479767112231668e-05,0.3704570231346187,512,large,True,False,0.11656282713056366,PRUNED
841,841,1.0,2023-04-27 12:23:53.801229,2023-04-27 12:24:44.378503,0 days 00:00:50.577274,tanh,0.07992307013300222,0.9,0.99,0.005101036734486211,0.4080800962077162,128,large,False,True,0.6264514802691077,PRUNED
842,842,1.0,2023-04-27 12:24:44.380502,2023-04-27 12:25:32.446178,0 days 00:00:48.065676,relu,0.028115087517308172,0.999,0.9,1.23585991658698e-05,3.231219785804136,64,small,True,False,0.5528256913863916,PRUNED
843,843,1.0,2023-04-27 12:25:32.447255,2023-04-27 12:26:24.018223,0 days 00:00:51.570968,tanh,0.0005087962816888912,0.95,0.995,1.7268684871226887e-05,0.5270262642147671,128,large,False,False,0.10532161284213834,PRUNED
844,844,40.0,2023-04-27 12:26:24.019224,2023-04-27 12:27:14.360395,0 days 00:00:50.341171,tanh,0.007131511120081254,0.999,0.9,0.0004783393389754429,0.3486550692288293,1024,large,True,False,0.22232057268205668,PRUNED
845,845,72.0,2023-04-27 12:27:14.361397,2023-04-27 12:28:08.715406,0 days 00:00:54.354009,tanh,0.003909479200803753,0.9,0.98,0.0008838025330922865,1.384142093535474,32,large,True,False,0.28712941207342396,PRUNED
846,846,1.0,2023-04-27 12:28:08.716786,2023-04-27 12:28:56.739403,0 days 00:00:48.022617,relu,0.0002281209860862884,0.999,0.9999,0.006482397032484892,0.6147074964435386,64,small,False,False,0.4207396925138504,PRUNED
847,847,1.0,2023-04-27 12:28:56.741406,2023-04-27 12:29:47.556580,0 days 00:00:50.815174,tanh,0.010248644254889543,0.995,0.9,1.1243394123700151e-05,0.30110555933204625,512,large,True,False,0.4552971387366912,PRUNED
848,848,1.0,2023-04-27 12:29:47.558085,2023-04-27 12:30:37.754338,0 days 00:00:50.196253,tanh,0.04332789495619406,0.95,0.99,1.4719797476639816e-05,0.3217997952625384,256,large,False,False,0.487342412030726,PRUNED
849,849,48.0,2023-04-27 12:30:37.755338,2023-04-27 12:31:32.448649,0 days 00:00:54.693311,tanh,0.016589607265888266,0.98,0.9,2.312229760798533e-05,0.4370767645434734,64,large,True,True,0.17004274413355813,PRUNED
850,850,0.0,2023-04-27 12:31:32.449650,2023-04-27 12:32:30.671546,0 days 00:00:58.221896,relu,0.04965027697820394,0.999,0.9,0.00032225094373970027,1.8164628839931376,128,tiny,False,False,0.8270800219686194,PRUNED
851,851,1.0,2023-04-27 12:32:30.673547,2023-04-27 12:33:21.862430,0 days 00:00:51.188883,tanh,0.02026485620135012,0.95,0.98,4.2559967586306044e-05,0.38321334640823806,64,small,True,False,0.12205896016190933,PRUNED
852,852,4.0,2023-04-27 12:33:21.864432,2023-04-27 12:34:32.118542,0 days 00:01:10.254110,tanh,0.00045257546480986837,0.9999,0.99,0.0005876377575617884,0.7541802611902799,16,large,False,False,0.23530718501476114,PRUNED
853,853,76.0,2023-04-27 12:34:32.120544,2023-04-27 12:35:25.092838,0 days 00:00:52.972294,tanh,0.001454309372732462,0.9,0.9,1.0026908688366526e-05,0.6696685503146728,128,large,True,False,0.15517508013555725,PRUNED
854,854,49.0,2023-04-27 12:35:25.094840,2023-04-27 12:36:16.317449,0 days 00:00:51.222609,relu,0.04777926681672778,0.999,0.9,0.0028732728145091507,0.8835764890586464,512,large,True,False,0.2724673285720755,PRUNED
855,855,1.0,2023-04-27 12:36:16.319451,2023-04-27 12:37:04.259363,0 days 00:00:47.939912,tanh,0.15076306175091664,0.999,0.9,0.001012504555664161,0.33630366199752665,64,small,False,False,0.25628559993976324,PRUNED
856,856,19.0,2023-04-27 12:37:04.261358,2023-04-27 12:37:59.464176,0 days 00:00:55.202818,tanh,0.06722863471856678,0.95,0.98,1.8478686942654654e-05,0.3576747456299626,32,large,True,False,0.13649925074645305,PRUNED
857,857,4.0,2023-04-27 12:37:59.467176,2023-04-27 12:39:52.732850,0 days 00:01:53.265674,relu,0.0003799745119176286,0.999,0.99,1.2516377167926247e-05,1.192271209667252,64,large,False,True,0.11313169142122996,COMPLETE
858,858,14.0,2023-04-27 12:39:52.735852,2023-04-27 12:41:00.174166,0 days 00:01:07.438314,tanh,0.0021790782440353085,0.98,0.995,7.485363071578377e-05,4.771006026767713,128,large,True,False,0.12708847525957717,PRUNED
859,859,1.0,2023-04-27 12:41:00.175172,2023-04-27 12:41:51.564411,0 days 00:00:51.389239,tanh,0.00040810605416315404,0.9,0.9,1.4963464511641446e-05,2.6490686085034545,1024,large,False,False,0.3602018791708481,PRUNED
860,860,25.0,2023-04-27 12:41:51.566413,2023-04-27 12:42:41.456326,0 days 00:00:49.889913,tanh,0.0005976316029959626,0.95,0.9999,3.184887770584284e-05,0.45416882386413276,64,small,True,False,0.6932874621782014,PRUNED
861,861,1.0,2023-04-27 12:42:41.460327,2023-04-27 12:43:35.082986,0 days 00:00:53.622659,relu,0.0006688082441393809,0.999,0.9,0.0004411850368802207,0.49901546319670503,512,large,False,False,0.10820039022866854,PRUNED
862,862,1.0,2023-04-27 12:43:35.084991,2023-04-27 12:44:26.812139,0 days 00:00:51.727148,tanh,0.003338362410248298,0.995,0.9,1.148101025829155e-05,0.9552457254211413,128,large,True,False,0.3311377591108681,PRUNED
863,863,1.0,2023-04-27 12:44:26.813138,2023-04-27 12:45:12.304369,0 days 00:00:45.491231,tanh,4.370446963041708e-05,0.95,0.98,1.994475592153997e-05,0.553156562485566,64,tiny,True,False,0.7238725130157082,PRUNED
864,864,1.0,2023-04-27 12:45:12.306369,2023-04-27 12:46:06.843630,0 days 00:00:54.537261,tanh,0.10255453294995155,0.99,0.99,0.000702214204798019,0.39514107682195726,64,large,False,False,0.30293987562891994,PRUNED
865,865,1.0,2023-04-27 12:46:06.845631,2023-04-27 12:46:57.731269,0 days 00:00:50.885638,relu,0.05289325753877814,0.999,0.9,6.193768068131424e-05,0.7156760568992706,128,small,True,True,0.25077540376936214,PRUNED
866,866,1.0,2023-04-27 12:46:57.733818,2023-04-27 12:47:53.074498,0 days 00:00:55.340680,tanh,0.13619838677108564,0.9,0.9,2.563524178070529e-05,0.796807713239819,512,large,False,False,0.6021314771817421,PRUNED
867,867,28.0,2023-04-27 12:47:53.075492,2023-04-27 12:48:47.099882,0 days 00:00:54.024390,tanh,0.06584549964572499,0.9999,0.9,1.6846124327572137e-05,1.519615683152979,64,large,True,False,0.6619261044119991,PRUNED
868,868,1.0,2023-04-27 12:48:47.101881,2023-04-27 12:49:39.696515,0 days 00:00:52.594634,tanh,0.003660131854014356,0.999,0.98,1.3158178935426682e-05,0.31615387901710285,32,large,False,False,0.2143681444789102,PRUNED
869,869,1.0,2023-04-27 12:49:39.697515,2023-04-27 12:50:27.012380,0 days 00:00:47.314865,relu,0.03777720943537048,0.95,0.99,1.1415430166243062e-05,0.5843437500145345,128,small,True,False,0.12019496573998628,PRUNED
870,870,1.0,2023-04-27 12:50:27.014382,2023-04-27 12:51:19.787135,0 days 00:00:52.772753,tanh,0.0184063786401773,0.98,0.9,4.790804056415198e-05,0.36387615635267,64,large,False,False,0.14377605613708785,PRUNED
871,871,50.0,2023-04-27 12:51:19.788136,2023-04-27 12:52:22.954928,0 days 00:01:03.166792,tanh,0.0074093338885517345,0.999,0.995,1.4235602917841866e-05,0.8434107881777109,512,large,True,False,0.23253531050041243,PRUNED
872,872,1.0,2023-04-27 12:52:22.956934,2023-04-27 12:53:14.501524,0 days 00:00:51.544590,relu,0.007543956033289734,0.9,0.9,0.001192429854227644,0.47130848362622707,64,large,True,False,0.10370657266076272,PRUNED
873,873,17.0,2023-04-27 12:53:14.502519,2023-04-27 12:54:02.403413,0 days 00:00:47.900894,tanh,0.0017984974820759586,0.95,0.9999,0.00733208966383853,0.3370726413722663,128,small,False,True,0.20306218518513036,PRUNED
874,874,1.0,2023-04-27 12:54:02.404413,2023-04-27 12:54:51.983933,0 days 00:00:49.579520,tanh,0.004395186235496458,0.999,0.9,0.0005291280342161021,0.41135243125853743,1024,large,True,False,0.8860799075357708,PRUNED
875,875,1.0,2023-04-27 12:54:51.984931,2023-04-27 12:55:43.230024,0 days 00:00:51.245093,tanh,0.006481091987528693,0.95,0.98,1.6636942676772174e-05,0.6198526988751425,64,large,False,False,0.11446646816700497,PRUNED
876,876,76.0,2023-04-27 12:55:43.232024,2023-04-27 12:56:29.130215,0 days 00:00:45.898191,relu,0.00022470176151920563,0.999,0.99,1.316507830113077e-05,0.5381834049847448,32,tiny,True,False,0.2710207511865468,PRUNED
877,877,1.0,2023-04-27 12:56:29.132213,2023-04-27 12:57:19.141491,0 days 00:00:50.009278,tanh,0.19849047415662546,0.9,0.9,0.00022433735942195326,1.0674309859493625,256,large,False,False,0.39961676550504405,PRUNED
878,878,39.0,2023-04-27 12:57:19.143490,2023-04-27 12:58:07.619150,0 days 00:00:48.475660,tanh,5.853217894394423e-05,0.995,0.9,0.00013708981415541907,0.3742801336440791,128,small,True,False,0.12972324547739772,PRUNED
879,879,1.0,2023-04-27 12:58:07.621150,2023-04-27 12:59:00.179696,0 days 00:00:52.558546,tanh,0.0009174002215408172,0.999,0.98,0.006770875729056935,0.6582572130612533,64,large,False,False,0.3179848183840098,PRUNED
880,880,0.0,2023-04-27 12:59:00.180693,2023-04-27 12:59:57.203966,0 days 00:00:57.023273,relu,0.005135187720250278,0.98,0.9,2.1590558735934183e-05,0.9899737814161567,512,large,True,False,0.15935973010935192,PRUNED
881,881,17.0,2023-04-27 12:59:57.205966,2023-04-27 13:00:57.073031,0 days 00:00:59.867065,tanh,0.005233973839851426,0.95,0.99,0.0003846664063333708,0.3367579080542093,64,large,False,True,0.5291130720086356,PRUNED
882,882,1.0,2023-04-27 13:00:57.074032,2023-04-27 13:02:09.730093,0 days 00:01:12.656061,tanh,2.707804528121569e-05,0.999,0.9,0.0001931828482897495,0.9024978473233048,16,large,True,False,0.2826953588726903,PRUNED
883,883,1.0,2023-04-27 13:02:09.732088,2023-04-27 13:03:02.988908,0 days 00:00:53.256820,tanh,0.00015041140259447496,0.9999,0.9,1.084354514534981e-05,0.5101717768879335,128,small,True,False,0.1855062065828306,PRUNED
884,884,1.0,2023-04-27 13:03:02.990909,2023-04-27 13:04:01.144163,0 days 00:00:58.153254,relu,0.02574863207220686,0.95,0.995,1.5502313964311636e-05,0.39259915974471987,64,large,False,False,0.954583453360953,PRUNED
885,885,1.0,2023-04-27 13:04:01.146164,2023-04-27 13:05:06.795616,0 days 00:01:05.649452,tanh,0.06167635746538258,0.9,0.98,1.807034144475923e-05,0.3170095699270482,512,large,True,False,0.11025208111661262,PRUNED
886,886,1.0,2023-04-27 13:05:06.797618,2023-04-27 13:06:18.491920,0 days 00:01:11.694302,tanh,0.0249781155137609,0.999,0.9,2.586300616508651e-05,0.3568110143376193,128,large,False,False,0.38018133920603797,PRUNED
887,887,0.0,2023-04-27 13:06:18.493913,2023-04-27 13:07:32.215811,0 days 00:01:13.721898,relu,0.017263924204554706,0.95,0.99,1.0057943541670865e-05,1.6893197446395147,64,small,True,False,0.5761813090232031,PRUNED
888,888,1.0,2023-04-27 13:07:32.217811,2023-04-27 13:08:34.398095,0 days 00:01:02.180284,tanh,0.0014928664966843222,0.999,0.9,3.839726863939493e-05,1.119091218355653,32,tiny,False,False,0.24084787451384185,PRUNED
889,889,7.0,2023-04-27 13:08:34.401093,2023-04-27 13:10:04.006426,0 days 00:01:29.605333,tanh,7.13364791555234e-05,0.98,0.9999,0.0008192701908815123,0.7564885514510621,64,large,True,True,0.10015941214659481,COMPLETE
890,890,67.0,2023-04-27 13:10:04.009425,2023-04-27 13:11:02.569217,0 days 00:00:58.559792,tanh,0.07177878897858221,0.9,0.9,1.2502509512917404e-05,0.4232359009746767,128,large,False,False,0.149951933289959,PRUNED
891,891,1.0,2023-04-27 13:11:02.570218,2023-04-27 13:11:56.260318,0 days 00:00:53.690100,relu,0.0007868218412637856,0.999,0.98,0.007423338864156541,0.5871236038762605,1024,large,True,False,0.2231467965294322,PRUNED
892,892,1.0,2023-04-27 13:11:56.263318,2023-04-27 13:12:52.507481,0 days 00:00:56.244163,tanh,0.001994528382159761,0.99,0.9,0.0019511782713396366,0.7183764084926332,64,small,True,False,0.17643889163466922,PRUNED
893,893,1.0,2023-04-27 13:12:52.509483,2023-04-27 13:13:51.733375,0 days 00:00:59.223892,tanh,3.960727172001293e-05,0.95,0.99,1.4203107713038463e-05,0.3437166145461261,512,large,False,False,0.12136680540029869,PRUNED
894,894,1.0,2023-04-27 13:13:51.736374,2023-04-27 13:15:03.103343,0 days 00:01:11.366969,tanh,0.003086951794025007,0.995,0.9,2.0481738415772002e-05,0.30157787859135565,128,large,True,False,0.2601462044114206,PRUNED
895,895,1.0,2023-04-27 13:15:03.104349,2023-04-27 13:16:03.524448,0 days 00:01:00.420099,relu,1.8925434167153326e-05,0.999,0.9,1.1461954645910026e-05,1.2182535029196329,64,large,False,False,0.13673843786404288,PRUNED
896,896,1.0,2023-04-27 13:16:03.527449,2023-04-27 13:17:01.595033,0 days 00:00:58.067584,tanh,0.08561451283468233,0.95,0.98,0.000638713491992625,4.377975620166576,64,small,True,False,0.505157786516419,PRUNED
897,897,54.0,2023-04-27 13:17:01.597034,2023-04-27 13:18:02.761296,0 days 00:01:01.164262,tanh,0.02171306834157362,0.999,0.9,0.0029819009031700726,0.9419553506457607,128,large,False,True,0.7675602107304437,PRUNED
898,898,3.0,2023-04-27 13:18:02.763297,2023-04-27 13:19:11.740014,0 days 00:01:08.976717,tanh,1.6512419117285613e-05,0.9,0.99,1.6539271468501533e-05,1.6709012676366977,32,large,True,False,0.10623803272695566,PRUNED
899,899,1.0,2023-04-27 13:19:11.742013,2023-04-27 13:20:17.746884,0 days 00:01:06.004871,relu,0.10339355880203367,0.9999,0.995,2.3864251464406176e-05,0.3703235326991526,512,large,False,False,0.43728024522712927,PRUNED
900,900,1.0,2023-04-27 13:20:17.747883,2023-04-27 13:21:20.684596,0 days 00:01:02.936713,tanh,0.00304748749947618,0.999,0.9,0.0015833062771739308,0.6803424992951614,64,tiny,True,False,0.2952649367165639,PRUNED
901,901,1.0,2023-04-27 13:21:20.687597,2023-04-27 13:22:30.700639,0 days 00:01:10.013042,tanh,0.12020894481331605,0.95,0.9999,0.00012116804440762512,0.32226528671709176,128,large,True,False,0.8726158419899089,PRUNED
902,902,21.0,2023-04-27 13:22:30.701640,2023-04-27 13:23:28.338701,0 days 00:00:57.637061,relu,0.00011314281903171304,0.98,0.9,2.795469480909064e-05,3.6512597798491804,64,small,False,False,0.11757744619291778,PRUNED
903,903,1.0,2023-04-27 13:23:28.340704,2023-04-27 13:24:19.511046,0 days 00:00:51.170342,tanh,0.0004801732454992291,0.999,0.98,7.47093132803887e-05,0.4779600343885995,512,large,True,False,0.42084680657161366,PRUNED
