,number,value,datetime_start,datetime_complete,duration,params_activation_fn,params_ent_coef,params_gae_lambda,params_gamma,params_lr,params_max_grad_norm,params_n_steps,params_net_arch,params_normalize_advantage,params_ortho_init,params_vf_coef,state
200,200,1.0,2023-04-27 02:30:32.501373,2023-04-27 02:31:24.915511,0 days 00:00:52.414138,relu,9.18880978207623e-06,0.9999,0.999,4.355847005824792e-05,1.6395951496518377,128,large,False,False,0.1039829898146923,PRUNED
201,201,25.0,2023-04-27 02:31:24.916510,2023-04-27 02:32:21.713124,0 days 00:00:56.796614,tanh,4.854070069533947e-06,0.999,0.9,1.8797484411961837e-05,1.3048739556456888,64,large,True,False,0.16329177143819648,PRUNED
202,202,1.0,2023-04-27 02:32:21.714125,2023-04-27 02:33:13.551983,0 days 00:00:51.837858,tanh,1.6001641088388519e-06,0.98,0.999,2.8165221408280543e-05,0.8965510467861213,32,large,True,False,0.2325180261496058,PRUNED
203,203,1.0,2023-04-27 02:33:13.553986,2023-04-27 02:34:02.698119,0 days 00:00:49.144133,tanh,3.497921611459303e-06,0.9999,0.9,1.1585989677241897e-05,1.1174504578169915,256,large,True,False,0.1083166407689052,PRUNED
204,204,1.0,2023-04-27 02:34:02.699120,2023-04-27 02:34:51.685304,0 days 00:00:48.986184,tanh,7.031161768574985e-06,0.999,0.9,2.271525326519528e-05,1.6534258079836832,1024,large,True,False,0.17679386068750055,PRUNED
205,205,1.0,2023-04-27 02:34:51.686305,2023-04-27 02:35:38.318044,0 days 00:00:46.631739,tanh,2.491228051704585e-06,0.999,0.999,1.6882731288433067e-05,2.3828872189792523,128,small,True,False,0.10075516151797383,PRUNED
206,206,61.0,2023-04-27 02:35:38.319046,2023-04-27 02:36:32.777987,0 days 00:00:54.458941,tanh,4.362760583351713e-05,0.999,0.9,1.0008566528357848e-05,1.2501895530280167,64,large,True,False,0.11696180963593399,PRUNED
207,207,1.0,2023-04-27 02:36:32.778987,2023-04-27 02:37:26.791415,0 days 00:00:54.012428,tanh,5.0270960170501934e-06,0.95,0.99,1.9707089268119792e-05,2.0710261807050103,16,large,True,True,0.14278251391681307,PRUNED
208,208,47.0,2023-04-27 02:37:26.792416,2023-04-27 02:38:44.508395,0 days 00:01:17.715979,relu,4.111867298496864e-06,0.9,0.9,1.1956189455262546e-05,0.5498163262088401,64,large,False,False,0.11137019614879631,COMPLETE
209,209,1.0,2023-04-27 02:38:44.510397,2023-04-27 02:39:35.374452,0 days 00:00:50.864055,relu,1.2582054495834721e-06,0.9,0.9,1.208304029152572e-05,2.578967334128861,64,large,False,False,0.10860941447960354,PRUNED
210,210,1.0,2023-04-27 02:39:35.375451,2023-04-27 02:40:22.524309,0 days 00:00:47.148858,relu,3.904114342821709e-06,0.9,0.999,1.1654772572496439e-05,0.37580220357328514,64,small,False,False,0.12368581062592544,PRUNED
211,211,79.0,2023-04-27 02:40:22.526310,2023-04-27 02:41:43.479281,0 days 00:01:20.952971,relu,2.830900393218559e-06,0.999,0.9,1.4719090830405616e-05,0.5766666228821103,64,large,False,False,0.11384420335308626,COMPLETE
212,212,15.0,2023-04-27 02:41:43.481280,2023-04-27 02:42:38.781628,0 days 00:00:55.300348,relu,2.9323317045769824e-06,0.9,0.9,1.4261409523734224e-05,0.4644835471992349,64,large,False,False,0.1130922428060388,PRUNED
213,213,1.0,2023-04-27 02:42:38.782627,2023-04-27 02:43:29.410728,0 days 00:00:50.628101,relu,1.98878689776199e-06,0.9,0.9,1.317445986833166e-05,0.5404782041201444,64,large,False,False,0.11863632241693958,PRUNED
214,214,0.0,2023-04-27 02:43:29.411727,2023-04-27 02:44:24.486747,0 days 00:00:55.075020,relu,7.350220791245982e-06,0.999,0.9,1.5462928526576315e-05,0.6442396640752186,64,large,False,False,0.10601157490364792,PRUNED
215,215,3.0,2023-04-27 02:44:24.487748,2023-04-27 02:45:19.655360,0 days 00:00:55.167612,relu,1.6029044497281545e-06,0.98,0.9,1.1333556585220754e-05,0.603686013131157,64,large,False,False,0.11429066160190253,PRUNED
216,216,1.0,2023-04-27 02:45:19.656357,2023-04-27 02:46:08.544947,0 days 00:00:48.888590,relu,2.408689077934853e-06,0.9,0.9,1.6484658471876027e-05,0.4307084700764244,1024,large,False,False,0.18812683920246517,PRUNED
217,217,24.0,2023-04-27 02:46:08.545945,2023-04-27 02:47:04.171848,0 days 00:00:55.625903,relu,1.1467890867056256e-05,0.9999,0.9,1.2549073743761167e-05,0.5391996628872019,64,large,False,False,0.1308054988545837,PRUNED
218,218,59.0,2023-04-27 02:47:04.172847,2023-04-27 02:47:55.396108,0 days 00:00:51.223261,relu,4.4919911454115215e-06,0.999,0.999,1.0059126402419354e-05,0.3573925920313765,128,large,False,True,0.1499042628109388,PRUNED
219,219,1.0,2023-04-27 02:47:55.397110,2023-04-27 02:48:43.627476,0 days 00:00:48.230366,relu,6.198220472505356e-06,0.999,0.9,1.445099095108857e-05,0.7359536488443339,32,small,False,False,0.10420251485468057,PRUNED
220,220,0.0,2023-04-27 02:48:43.628477,2023-04-27 02:49:38.818916,0 days 00:00:55.190439,relu,3.0232067277877483e-06,0.999,0.9,1.8075375409338848e-05,0.6424799735848732,64,large,False,False,0.1113998925505,PRUNED
221,221,1.0,2023-04-27 02:49:38.819918,2023-04-27 02:50:29.608432,0 days 00:00:50.788514,tanh,3.5994743793653727e-06,0.999,0.9,2.1691881535047412e-05,0.38847178950294436,64,large,True,False,0.26603267970883837,PRUNED
222,222,14.0,2023-04-27 02:50:29.610433,2023-04-27 02:51:21.935475,0 days 00:00:52.325042,tanh,2.0084374716599676e-06,0.999,0.9,2.5689330582028105e-05,0.6034444060303608,64,large,True,False,0.10009611835557003,PRUNED
223,223,71.0,2023-04-27 02:51:21.936475,2023-04-27 02:52:42.550817,0 days 00:01:20.614342,tanh,4.434592627005195e-06,0.999,0.9,1.273551407246159e-05,1.1662776668200048,64,large,True,False,0.24952770169771346,COMPLETE
224,224,1.0,2023-04-27 02:52:42.552819,2023-04-27 02:53:33.039773,0 days 00:00:50.486954,tanh,5.228236412863313e-06,0.999,0.9,5.814021507805439e-05,1.1001587136791073,64,large,True,False,0.24812250519881554,PRUNED
225,225,97.0,2023-04-27 02:53:33.040778,2023-04-27 02:54:52.984790,0 days 00:01:19.944012,tanh,7.170871875030042e-05,0.95,0.9,1.1493025489733423e-05,0.9983198478785485,512,large,True,False,0.23892464895228163,COMPLETE
226,226,94.0,2023-04-27 02:54:52.986793,2023-04-27 02:55:56.896741,0 days 00:01:03.909948,tanh,1.929387834463336e-05,0.95,0.9,1.1571437341909166e-05,0.5712628727900695,512,tiny,True,False,0.24092897723075551,COMPLETE
227,227,1.0,2023-04-27 02:55:56.897741,2023-04-27 02:56:39.849058,0 days 00:00:42.951317,tanh,2.647999343087871e-05,0.95,0.995,1.1171585659794724e-05,0.35199122936677735,512,tiny,True,False,0.2266132036672904,PRUNED
228,228,1.0,2023-04-27 02:56:39.850058,2023-04-27 02:57:22.888430,0 days 00:00:43.038372,tanh,1.5795140766860865e-05,0.95,0.9,1.2794650612465104e-05,0.3124671267578093,512,tiny,True,False,0.21302002713834478,PRUNED
229,229,13.0,2023-04-27 02:57:22.889435,2023-04-27 02:58:06.386466,0 days 00:00:43.497031,relu,5.98450680763261e-05,0.95,0.999,1.1215923874276854e-05,0.4982469413603724,512,tiny,False,True,0.23881928943317718,PRUNED
230,230,1.0,2023-04-27 02:58:06.387471,2023-04-27 02:58:49.331526,0 days 00:00:42.944055,tanh,2.0579336559477072e-05,0.95,0.9,1.3016012142618793e-05,0.30065028680363376,1024,tiny,True,False,0.12240720273099492,PRUNED
231,231,1.0,2023-04-27 02:58:49.332527,2023-04-27 02:59:32.379497,0 days 00:00:43.046970,tanh,8.821932763623435e-06,0.99,0.9,1.445799241768498e-05,1.2250546824149664,512,tiny,True,False,0.23404605168744982,PRUNED
232,232,4.0,2023-04-27 02:59:32.380498,2023-04-27 03:00:21.511816,0 days 00:00:49.131318,tanh,6.923056408041323e-06,0.95,0.9,1.1242560049285622e-05,0.5480536471090354,512,large,True,False,0.24959531922929154,PRUNED
233,233,1.0,2023-04-27 03:00:21.512817,2023-04-27 03:01:12.497800,0 days 00:00:50.984983,tanh,4.233029183044818e-05,0.95,0.9,1.304682285055961e-05,1.1774197039069176,512,large,True,False,0.20425462235177358,PRUNED
234,234,20.0,2023-04-27 03:01:12.499797,2023-04-27 03:02:03.768525,0 days 00:00:51.268728,tanh,1.9007895459638537e-05,0.95,0.9,1.5196748274694497e-05,0.37340279223595213,512,large,True,False,0.2244945592848138,PRUNED
235,235,1.0,2023-04-27 03:02:03.769523,2023-04-27 03:02:50.887073,0 days 00:00:47.117550,tanh,1.0765223823147995e-05,0.95,0.99,1.0082859187866772e-05,0.5841367413782469,512,small,True,False,0.10915605032931726,PRUNED
236,236,0.0,2023-04-27 03:02:50.888074,2023-04-27 03:03:45.199426,0 days 00:00:54.311352,tanh,1.4662969322231024e-05,0.9999,0.98,0.00010032184816855215,0.5252565615950489,128,large,True,False,0.1133398592060784,PRUNED
237,237,4.0,2023-04-27 03:03:45.200428,2023-04-27 03:04:37.006301,0 days 00:00:51.805873,tanh,6.824117007885259e-05,0.98,0.9,1.197949851138125e-05,1.058853947258685,32,large,True,True,0.1666441959281738,PRUNED
238,238,1.0,2023-04-27 03:04:37.008303,2023-04-27 03:05:26.155599,0 days 00:00:49.147296,relu,5.930696256059869e-06,0.995,0.9999,1.6583593475997675e-05,1.1705339243586037,512,large,False,False,0.10576036716306411,PRUNED
239,239,8.0,2023-04-27 03:05:26.156598,2023-04-27 03:06:18.940399,0 days 00:00:52.783801,tanh,4.25773859487283e-06,0.9,0.999,1.0071845663318262e-05,0.5704781672285196,64,large,True,False,0.11821305329270541,PRUNED
240,240,1.0,2023-04-27 03:06:18.941396,2023-04-27 03:07:05.083502,0 days 00:00:46.142106,tanh,8.327287730739264e-06,0.95,0.9,1.3114990247914922e-05,1.0031068311391267,1024,small,True,False,0.2385114258288018,PRUNED
241,241,1.0,2023-04-27 03:07:05.084500,2023-04-27 03:07:56.061460,0 days 00:00:50.976960,tanh,3.2020694686613523e-06,0.999,0.9,0.006751100206579161,1.1714011564720206,64,large,True,False,0.26575804209776915,PRUNED
242,242,1.0,2023-04-27 03:07:56.062462,2023-04-27 03:08:46.585358,0 days 00:00:50.522896,tanh,4.480147314155657e-06,0.999,0.9,1.1703645696712596e-05,0.904414545046654,64,large,True,False,0.2801970906863979,PRUNED
243,243,1.0,2023-04-27 03:08:46.586357,2023-04-27 03:09:37.011340,0 days 00:00:50.424983,tanh,9.896802559520809e-05,0.999,0.9,1.4730851196579517e-05,0.6855549956710606,64,large,True,False,0.25578415437658236,PRUNED
244,244,4.0,2023-04-27 03:09:37.013347,2023-04-27 03:10:27.493606,0 days 00:00:50.480259,tanh,2.553385056604172e-06,0.999,0.9,8.071221283524279e-05,1.0644297647351173,64,large,True,False,0.2928784444065687,PRUNED
245,245,1.0,2023-04-27 03:10:27.494612,2023-04-27 03:11:19.556252,0 days 00:00:52.061640,tanh,3.238285381431838e-05,0.999,0.9,1.830225996429189e-05,0.3361812629353469,64,large,True,False,0.10445424241941675,PRUNED
246,246,1.0,2023-04-27 03:11:19.558253,2023-04-27 03:12:09.936911,0 days 00:00:50.378658,tanh,0.00029527828447855047,0.9999,0.9,3.8868025336473094e-05,0.9727211806024925,64,large,True,False,0.27434343307745696,PRUNED
247,247,17.0,2023-04-27 03:12:09.937912,2023-04-27 03:13:00.664619,0 days 00:00:50.726707,tanh,3.6499426435583393e-06,0.9,0.999,0.00016537379591379013,1.4380944414599948,128,large,False,True,0.2494684251480618,PRUNED
248,248,1.0,2023-04-27 03:13:00.665619,2023-04-27 03:13:51.858338,0 days 00:00:51.192719,relu,1.5623703256138167e-06,0.999,0.9,1.3692488755251564e-05,0.4071925169928295,64,large,True,False,0.24029237372081166,PRUNED
249,249,1.0,2023-04-27 03:13:51.859337,2023-04-27 03:14:35.310914,0 days 00:00:43.451577,tanh,7.0647756656821154e-06,0.95,0.9,1.1793678713811483e-05,0.7620363184535546,256,tiny,True,False,0.21631295602273068,PRUNED
250,250,1.0,2023-04-27 03:14:35.311915,2023-04-27 03:15:22.727585,0 days 00:00:47.415670,tanh,5.3572505685118855e-06,0.98,0.999,2.058871346296207e-05,1.2821940368031948,64,small,True,False,0.3130511234313181,PRUNED
251,251,0.0,2023-04-27 03:15:22.728587,2023-04-27 03:16:19.471428,0 days 00:00:56.742841,relu,1.0113180257533075e-05,0.999,0.9,1.610857813409592e-05,0.8518570283785748,32,large,False,False,0.11150189714357599,PRUNED
252,252,18.0,2023-04-27 03:16:19.473427,2023-04-27 03:17:13.586565,0 days 00:00:54.113138,tanh,2.4064591830531564e-06,0.999,0.9,1.1473100276672748e-05,0.704682744110526,16,large,True,True,0.1740535792738542,PRUNED
253,253,46.0,2023-04-27 03:17:13.587561,2023-04-27 03:18:03.494869,0 days 00:00:49.907308,tanh,2.6453991027146125e-05,0.9999,0.99,3.3395152990573506e-05,1.5784723235501152,1024,large,True,False,0.19201585081352404,PRUNED
254,254,86.0,2023-04-27 03:18:03.495868,2023-04-27 03:19:24.309408,0 days 00:01:20.813540,tanh,3.1363925374562696e-06,0.999,0.9,2.4125874130698157e-05,0.941918693015488,64,large,False,False,0.10001857144186417,COMPLETE
255,255,36.0,2023-04-27 03:19:24.310412,2023-04-27 03:20:15.602149,0 days 00:00:51.291737,relu,1.8234490527690285e-06,0.9,0.999,2.9069535380379555e-05,0.9386700211046665,64,small,False,False,0.10338498597289607,PRUNED
256,256,42.0,2023-04-27 03:20:15.603148,2023-04-27 03:21:06.142431,0 days 00:00:50.539283,tanh,1.3191903978621086e-05,0.95,0.9,1.0093164260807328e-05,0.35849956412323947,128,large,False,False,0.1000183320690313,PRUNED
257,257,15.0,2023-04-27 03:21:06.143429,2023-04-27 03:21:58.842383,0 days 00:00:52.698954,tanh,1.1721685617227687e-06,0.999,0.9,1.746143198357689e-05,1.007837479363272,64,large,False,True,0.10874222587618003,PRUNED
258,258,1.0,2023-04-27 03:21:58.843381,2023-04-27 03:22:49.810140,0 days 00:00:50.966759,relu,4.4054264087666955e-06,0.999,0.999,1.34959814553432e-05,0.8316785162699386,64,large,False,False,0.12620731693889545,PRUNED
259,259,53.0,2023-04-27 03:22:49.812141,2023-04-27 03:23:42.697215,0 days 00:00:52.885074,tanh,0.019088101884342765,0.98,0.9,1.509180185017207e-05,0.6665247919410707,512,large,False,False,0.11684751915854799,PRUNED
260,260,4.0,2023-04-27 03:23:42.699216,2023-04-27 03:24:28.947031,0 days 00:00:46.247815,tanh,2.7433925142096216e-06,0.999,0.9,2.4271164908163085e-05,0.3259766663764889,1024,small,False,False,0.10528077022408175,PRUNED
261,261,1.0,2023-04-27 03:24:28.948031,2023-04-27 03:25:19.640565,0 days 00:00:50.692534,tanh,5.937049789986087e-06,0.9999,0.9,5.273382519092458e-05,0.46709437977739093,64,large,False,False,0.20309241853139784,PRUNED
262,262,24.0,2023-04-27 03:25:19.642566,2023-04-27 03:26:11.620976,0 days 00:00:51.978410,relu,1.400420129630969e-06,0.9,0.995,1.2333325526497505e-05,0.3481635649043898,32,large,True,True,0.10011647841266898,PRUNED
263,263,1.0,2023-04-27 03:26:11.622980,2023-04-27 03:26:54.979401,0 days 00:00:43.356421,tanh,2.1202042816972528e-06,0.95,0.999,1.8073878473727255e-05,1.0857940579220864,64,tiny,False,False,0.15500075536237506,PRUNED
264,264,55.0,2023-04-27 03:26:54.980407,2023-04-27 03:27:46.038882,0 days 00:00:51.058475,tanh,8.21101096836175e-06,0.999,0.9,2.01189570415088e-05,0.3870148072146254,128,large,True,False,0.1350964883036187,PRUNED
265,265,1.0,2023-04-27 03:27:46.040882,2023-04-27 03:28:36.604853,0 days 00:00:50.563971,tanh,8.37097303526534e-05,0.99,0.9,1.1289869441545846e-05,0.4139123889951041,64,large,True,False,0.10997567615841251,PRUNED
266,266,1.0,2023-04-27 03:28:36.605855,2023-04-27 03:29:23.738583,0 days 00:00:47.132728,relu,3.737647925945721e-06,0.999,0.99,1.4014489989675997e-05,0.3187741557307775,64,small,False,False,0.11931730893184807,PRUNED
267,267,1.0,2023-04-27 03:29:23.739582,2023-04-27 03:30:12.921395,0 days 00:00:49.181813,tanh,5.4377718178352825e-06,0.999,0.9,6.810907756045919e-05,0.3705384829733038,1024,large,True,False,0.17968796563161774,PRUNED
268,268,61.0,2023-04-27 03:30:12.923398,2023-04-27 03:31:05.213594,0 days 00:00:52.290196,tanh,3.602895439014693e-05,0.995,0.999,2.620463094841551e-05,0.6266377830981951,64,large,True,True,0.10610792093491987,PRUNED
269,269,0.0,2023-04-27 03:31:05.215591,2023-04-27 03:32:02.148655,0 days 00:00:56.933064,relu,2.997072089708484e-06,0.95,0.9999,4.3607086920400074e-05,0.49846017966903255,512,large,True,False,0.22511752625832188,PRUNED
270,270,48.0,2023-04-27 03:32:02.150650,2023-04-27 03:33:23.862086,0 days 00:01:21.711436,tanh,1.0021935787720063e-06,0.98,0.98,1.2850598739873245e-05,0.3389367049674941,64,large,False,False,0.11187905335368077,COMPLETE
271,271,1.0,2023-04-27 03:33:23.864086,2023-04-27 03:34:14.764152,0 days 00:00:50.900066,tanh,1.0730395944799668e-06,0.98,0.98,1.0098462412306478e-05,0.3290209493336588,64,large,False,False,0.11470606913431282,PRUNED
272,272,47.0,2023-04-27 03:34:14.766162,2023-04-27 03:35:02.754288,0 days 00:00:47.988126,tanh,1.5266834573059008e-06,0.9999,0.98,1.3009329674441474e-05,0.3507019506886349,128,small,False,False,0.1107149682876161,PRUNED
273,273,78.0,2023-04-27 03:35:02.756288,2023-04-27 03:36:23.879783,0 days 00:01:21.123495,tanh,1.1914303965232748e-06,0.98,0.98,1.528442844850779e-05,0.34324844158697243,32,large,False,False,0.3307336667148321,COMPLETE
274,274,1.0,2023-04-27 03:36:23.880787,2023-04-27 03:37:16.192976,0 days 00:00:52.312189,tanh,1.0149311486091934e-06,0.98,0.98,1.574114349768674e-05,0.33919997882762465,32,large,False,True,0.14260620039957078,PRUNED
275,275,1.0,2023-04-27 03:37:16.194979,2023-04-27 03:38:08.188934,0 days 00:00:51.993955,tanh,1.2965836701547574e-06,0.98,0.98,1.6047035958731483e-05,0.3007296211738509,32,large,False,False,0.33704305121173056,PRUNED
276,276,1.0,2023-04-27 03:38:08.189934,2023-04-27 03:38:59.738082,0 days 00:00:51.548148,tanh,1.7662369672365006e-06,0.98,0.98,1.427543871313329e-05,0.37145035945528265,32,large,False,False,0.5422264294473106,PRUNED
277,277,1.0,2023-04-27 03:38:59.739079,2023-04-27 03:39:43.459317,0 days 00:00:43.720238,tanh,1.2813856938904368e-06,0.98,0.98,1.7718545930077067e-05,0.7501584551883831,32,tiny,False,False,0.12276581084363518,PRUNED
278,278,0.0,2023-04-27 03:39:43.460317,2023-04-27 03:40:39.985657,0 days 00:00:56.525340,tanh,1.689259832314589e-06,0.98,0.98,1.2513722205027886e-05,0.31948394167608557,32,large,False,False,0.33357725762944607,PRUNED
279,279,44.0,2023-04-27 03:40:39.986658,2023-04-27 03:41:28.410980,0 days 00:00:48.424322,tanh,0.00012493714820378574,0.98,0.98,1.1162025804517471e-05,0.8006131767142272,1024,small,True,True,0.1596870874774719,PRUNED
280,280,0.0,2023-04-27 03:41:28.411983,2023-04-27 03:42:22.380112,0 days 00:00:53.968129,tanh,2.0010994597914634e-06,0.98,0.98,1.4634552707800911e-05,0.3441992804568665,256,large,False,False,0.12869257872135473,PRUNED
281,281,34.0,2023-04-27 03:42:22.382111,2023-04-27 03:43:12.835227,0 days 00:00:50.453116,tanh,1.2525827903689196e-06,0.98,0.999,1.8541225549565266e-05,0.4391865042101124,128,large,True,False,0.10454314569326836,PRUNED
282,282,65.0,2023-04-27 03:43:12.837228,2023-04-27 03:44:05.506120,0 days 00:00:52.668892,tanh,1.0371112617914046e-06,0.95,0.999,1.0104792399586712e-05,0.38576412820906403,32,large,True,False,0.11616762445583456,PRUNED
283,283,0.0,2023-04-27 03:44:05.508124,2023-04-27 03:44:59.056828,0 days 00:00:53.548704,tanh,5.3157905559638465e-05,0.98,0.98,0.0006738849634676463,0.36255615198236524,512,large,True,False,0.14768634929221866,PRUNED
284,284,1.0,2023-04-27 03:44:59.057829,2023-04-27 03:45:48.624983,0 days 00:00:49.567154,tanh,2.3513233683263896e-06,0.9999,0.999,1.3249218148714074e-05,0.8642986495866015,16,small,False,True,0.1992376054726247,PRUNED
285,285,1.0,2023-04-27 03:45:48.625982,2023-04-27 03:46:39.323259,0 days 00:00:50.697277,tanh,1.7549748495576907e-05,0.999,0.99,1.586731458467363e-05,0.9444177571529454,64,large,True,False,0.10005341129948027,PRUNED
286,286,1.0,2023-04-27 03:46:39.324260,2023-04-27 03:47:29.128651,0 days 00:00:49.804391,tanh,0.0001395230955786113,0.95,0.999,2.07569147126516e-05,0.33483055233267267,1024,large,True,False,0.29790797365518973,PRUNED
287,287,87.0,2023-04-27 03:47:29.129649,2023-04-27 03:48:47.363936,0 days 00:01:18.234287,tanh,0.00020623783393038456,0.999,0.9,1.1489167521244678e-05,0.4008805813496967,64,large,False,False,0.10836788211010133,COMPLETE
288,288,71.0,2023-04-27 03:48:47.366936,2023-04-27 03:49:39.383815,0 days 00:00:52.016879,tanh,0.0001585811972731593,0.999,0.9,4.872399276973061e-05,0.392006418371956,128,large,True,False,0.1069131129183254,PRUNED
289,289,1.0,2023-04-27 03:49:39.384816,2023-04-27 03:50:26.759621,0 days 00:00:47.374805,tanh,6.77552418477845e-05,0.999,0.9,1.1212659157106065e-05,0.40403822678244505,64,small,True,True,0.2105001043323993,PRUNED
290,290,1.0,2023-04-27 03:50:26.760625,2023-04-27 03:51:11.518629,0 days 00:00:44.758004,tanh,0.0004403022182940226,0.999,0.9,2.3033576737003076e-05,0.4212001825762161,32,tiny,False,False,0.1198886329401034,PRUNED
291,291,1.0,2023-04-27 03:51:11.519629,2023-04-27 03:52:02.860449,0 days 00:00:51.340820,tanh,2.875144534068303e-06,0.999,0.9,3.1709048524711915e-05,0.3664791200796275,64,large,True,False,0.10363746752186673,PRUNED
292,292,1.0,2023-04-27 03:52:02.861449,2023-04-27 03:52:52.507051,0 days 00:00:49.645602,tanh,0.0001033821453322426,0.999,0.9,0.00019945962154537637,0.3114099566529155,512,large,True,False,0.1884713468999118,PRUNED
293,293,47.0,2023-04-27 03:52:52.508049,2023-04-27 03:53:46.616983,0 days 00:00:54.108934,tanh,1.1078365936812197e-05,0.999,0.9,1.1312975946889519e-05,1.3087477786457036,64,large,False,False,0.10826010187220679,PRUNED
294,294,1.0,2023-04-27 03:53:46.617982,2023-04-27 03:54:35.578208,0 days 00:00:48.960226,tanh,2.2296676289074953e-06,0.9999,0.9,1.5066641481225406e-05,1.0194070754194657,1024,large,True,True,0.2334396201433731,PRUNED
295,295,4.0,2023-04-27 03:54:35.579207,2023-04-27 03:55:22.859676,0 days 00:00:47.280469,tanh,3.096608568423529e-05,0.999,0.9,3.6796629015533065e-05,0.4458021399916875,64,small,True,False,0.1712412848396821,PRUNED
296,296,0.0,2023-04-27 03:55:22.861675,2023-04-27 03:56:17.050740,0 days 00:00:54.189065,tanh,0.001122927316100629,0.95,0.999,1.295429126000297e-05,0.3871395022694603,128,large,False,False,0.12593547963200755,PRUNED
297,297,91.0,2023-04-27 03:56:17.052739,2023-04-27 03:57:35.955073,0 days 00:01:18.902334,tanh,0.00017138019560998248,0.999,0.995,1.6622062651627367e-05,0.9026157028123913,64,large,True,False,0.13315827906520092,COMPLETE
298,298,1.0,2023-04-27 03:57:35.957072,2023-04-27 03:58:26.457379,0 days 00:00:50.500307,relu,0.00015347745204630163,0.999,0.995,1.6791258865529468e-05,0.9361194642719162,64,large,True,False,0.12896687530887158,PRUNED
299,299,0.0,2023-04-27 03:58:26.459382,2023-04-27 03:59:22.697892,0 days 00:00:56.238510,tanh,0.000479760804321705,0.999,0.995,1.0039326520067804e-05,0.8893119588139374,32,large,True,False,0.13509284319984272,PRUNED
